001	Remenicing on last summer when I was soaked in a champagne pool partying with the slut whisperer good times good times
001	 fancylanterns WraythTheMad added makeup he x89 s sassy ready bitch t co NWWkI7Ih8u 
001	 DommeAilith Please break me Goddess Ailith Break me Peg me Bind and gag me I ll be a good little SLUT 
001	BIG TIT ASIAN OFFICE SLUT CAUGHT MASTURBATING IN HEELS amp STOCKING 
001	 camera inside vagina training dragonball naked leggings facial cumshot spiderman porn x89 t co Co1KMeoVzK 
001	 ArcadeNoise I m always a slut for vampires
001	RT Jenacampbellxxx ken wot a dont need some boyf thats gony treat me like shit i can be a fooking slut without worrying about a bf giv 
001	Mandy bangs plumbers angles n t co H81ED76esW Searchanalporn danish cumshot x89 t co NW4CkAu1s6 
001	 x89 He x89 s bitch bitch slut x89 x9d melissa 
001	 Aesthetic Footjobs Lizzy footjob n t co owte6s5Ezo cumshot masterbating feet 
001	 ThisCharmingB0y Spidey Slut Catholicism mainstream religion makes values 
001	wanna dress slut dress slut That x89 s x89 x9d x95 x8f 
001	 xander dre Slut shaming Nikki their haters evils yesterday s promo women s history WW x89 
001	Excuse my language but Son of mother flying fucking bitch flying fucking cunt bag shit hole whoring mother of swee 
001	dadshot liked one of my fucking ava clips im geekin
001	 dildo rough first movie boobs horny pussy pokemon hentai unexpected cu x89 t co pIZSpCq1ho 
001	Dm for STRAIGHT cockrate I m so high rn and bored af I ll also send pics of girls too horny ass sellingnudes 
001	 KalinaCasas Or be the boujee bitch u are and get some from Whole Foods I m a slut for it too
001	fuk bitches gimme a fat slut that cooks and does dishes 
001	 And i x89 d think mother yesterday called x89 slut x89 x9d roughly today x89 t co QnpqeOHXAQ 
001	 breasts primary school pornsexteen positions naked pussy shots t co txoeSxuObt 
001	 classy bitch thick sassy orders bitch rappy much x89 t co vjNmO3VWcJ 
001	basically doesn x89 t wanna really quoted tried clown x89 slut sham x89 t co Rs3VKR8qGn 
001	 native american older women x men first dance beads slut x89 t co hl1KoKRjyD 
001	people have already forgotten Miley s nudes on 2013 when ya ll called her a bitch and slut just bc she does whate 
001	photo grid girl slut free xxx trailers best body nude demi lovato cartoon porn girls naked in the water porn teen s 
001	 Idc you x89 re bitch Slut whore those general areas 
001	this bitch fucking TRYing me tryna slut shame me when i m GRIEVEing the whole ass loss of a family member on some h 
001	 ninja celebrity nudes underworld black deepthroat cumshot indian gypsy lesbian l x89 t co 2oXmVbTCNr 
001	RT MELTlNQ i am a white mans whore amp a slut for girls
001	 unwanted facials asian videos schoolgirl having cuckold interracial hentai greek exotic porn x89 t co 3OAOAX3GGt 
001	 British pussy cumshot indian stars uncircumcised hours agoRakel Liekki x89 t co AADybXmc24 
001	Hey bitch Hey slut Best friend conversation sotrue girls 
001	RT IslaAlder My DMs are dry amp my pussy is wet who wants to see horny hornyteen wet porn teenporn jailbait fuckme slut snap 
010	 EmilySuess Let s add slut shaming Melania to this She s horrible in about 600 ways we shouldn t have to fixate on her modeling past 
001	 you filters people pretty bella looks sassy bitch tho x89 t co yyx4wrVjFF 
001	Then loud on the phone like Chubbs amp Ava ain t sleep He want the whole house up w his ass 
001	Bitches ain t shit they have a down ass nigga but cheat on him multiple times amp when that hoe gets caught she ki 
001	pics topnonnudeteenmodel xxxxdirty dvd anal ramming free yugioh porn starring dark magician girl videos babes porn 
001	Wish I was a hot girl so I could get paid to slut around and drink bang energy drinks 
001	RT needygws this girl is the nastiest skank bitch ive ever met DO NOT TRUST HER she is a fugly slut 
001	 BUT WAITTTTTT SHAME WOMEN PAYED SEX bitch cancelled PERIODT t co gmlRlJn3Zn 
001	 cam fucked ass n t co CZmcK1OZ5Y choked fucked assamxxx tamil fa x89 t co 9wFe5HuhDe 
001	Ya know what FashionNova probably needs to dip into children s clothes cuz you bitches still got Jr amp Ava in 2 Ch 
001	 avaomalleyy l0vetest ava your taste is fuckingshit 
001	 dennisetwt isn t slut x89 n nshe s nctzen 
001	i ve become such a slut for diet coke
001	RT domdom lynn weird to me that the girls who put out on the first date get slut shamed so hard but is the same girls y all be hitting u 
001	 HarunoMiyabi if it were a boy that would be a fuckboi So a fuckgirl a slut 
001	Slut shaming pisses me off I just angrily asked why some millionaire getting a blow job is news amp the response of 
001	 USAsalat sassy bitch monk n No t co 9sabbNzYf4 
001	hello girls what s the dumbest thing your parents have slut shamed you for my sister stuck out her tongue in a se 
001	 why people called slut she s active sexual talk called cool active it 
001	 jerikaxteam10 alissa never wants people slut shame others didn x89 t follow insta account page x89 
001	 wife facial naked lesbians bisexual threesome sluts longest cumshot young throats x89 t co NDHMA79XkT 
001	 KapustinZhores pussyfucked brunette analfucked pussy hardcore bitch sexy t co TS3OOtMZNc 
001	 Brazzers AvaAddams ava hands down She puts you in a nice trance with her boobs especially when she titfucks x
001	RT LARRAYXO why am i ugly jk bitch that wasn t a joke 
001	ava max is actually so underrated her songs are fucking bops 
001	 jiwoobun key slut being kristin chenoweth reach him 
001	 Looking interested seeing cock cock tits daddy slut nudes ddbg 
001	Selling dropbox and mega links dropbox megalink nudes CamFam camgirltakeover slut petplay cumshots 
001	 RT Follow if you want hot boobs in DM sessions booty boob camgirl slut snapchatslut cock nudes 
001	When I listen to LanaDelRey she makes me feel like a bad bitch a sad bitch and a slut all in one 
001	Dick sucking lips girls ebony cumtribute cocktribute spittribute faptribute tribute lips dsls 
001	 x89 x8f watch x89 x8f n nt co bMWvfGsobg n ntwink whore reality abusedteen bitch spanking faggo x89 t co Zic057hfi4 
001	 Car Cumshot n t co 77tcZL1Ide divini hardcore cumshot forced blowjob tricked s x89 t co H3Afv0F3ue 
001	RT 1dbanks When do bitches grow out of that childish slut mindset only if they have one
001	Her soft moaning makes creampie better xxx 18 nsfw orgasm wet horny pussy sex porn video xxx rt follow 
001	sleeps bunch dudes she s slut what s thing Gay n nDefinitely a x89 t co AjIelxRIbA 
001	first is annie anastasia ur a fucking bitch and let me tell u why tw so i was dating u u broke up w me i blo 
001	RT BigKdawg095 When you walk in the party amp you see all the opps in that bitch 
001	 porn bushy carmel moore daniella jaclyn marcus unexpected cumshot whitney stevens young old x89 t co 7aIB73u3qr 
001	lynn spears naked video http youngpornsite ever girls fucking doorknobs reality kings hd school interracial slut 
001	RT Brianna02021217 Like amp Retweet and DM if you want nudes in your cock sexy nude teen sext jailbait horny nudes cumtribute 
001	 find6xyz gingerspyce masturbating webcam n t co zUFo74UXMY school maldives porn x89 t co NLIEDLiWtR 
001	 KamalaHarris doesn t like the S word Says she isn t a Democratic Socialist She however is a Democrat Slut Can t 
001	 Ain x89 t princess bitch arianagrande n n n n blonde hairgoals dramaqueen cannabisoil x89 t co EGzCxb8z9D 
001	 porn mouth teentube drunk cumshot japanese teacher omegle boobs creampie britai x89 t co Af1w71vzeD 
001	 x81 massive cumshot after shower Russian eating sloppy blowjob xa0 t co uJGrUXPRlg 
001	RT mariahMlongoria Dudes who sleep with the MOST girls are always the first to slut shame
001	RT swamplexus war hammer rules they got a god of trans people and a goddess of actin like a slut and listening to music too loud 
001	it s literally what you deserve for slut shaming and body shaming jesy and the girls calling jesy fat when she s i 
100	RT maxipenalty When will the phenomenon of white women with no personality who can t do literally anything without wine just fucking die 
001	 porn leash cunnilingus vadia young creampie t co n80L46jFSO 
001	 Porno Videot Manga Porno pussy Tokyo Video Pornn Filme Porno Porno Dingue porno video hd x89 t co 1zSVQ2jhrQ 
001	Horny girl here looking for a daddy horny cum cumtribute hornygirl slut porn dmme 
001	 xx em0 slut xx sleep paralysis 
001	This BITCH taking off work for her ANNUAL SECTION 8 REVIEW Like I need Section 8 amp time off my job at the COU 
001	girlfriend jessica letting pussy mouth n t co d2RgfDBjXs sister s x89 t co oo4BoBk4Aa 
001	 xa0 npussy amateur adult women nporno snapchatme hairy xxx nsnapme x89 t co l6aMf9tS4c 
001	 WebCam Sex Chat Chat with real girls and exchange nudes with horny MILFs Follow the below link and have lots of 
001	i spent countless games in AT amp T park being called philly slut and filthadelphia by GROWN ASS MEN a dodgers fan 
001	rt amp dm if you want nudes horny teen nudes booty tits ass pussy cum jailbait slut cocktease cumslut 
100	 Dj Niner Fundamentals345 She shouldn t even be where she is That s fucking dumb as hell She has got to grow up 
001	boy kissing girl in public places teen non nude panties pictures goth cunt small tits teen gia carangi nude slut vi 
001	 can t bitch t co gWhiXGdZx8 
001	 That bitch you married ain t shit Loool He s the one who fell in love eith the neighborhood slut SMH 
001	 Some article mentioned targeting easy girls n nListen could sluttiest slut x89 t co b5AGwAZo4p 
001	I bet she is an anal slut 18 only camgirl porn whore horny boobs 
001	photo grid girl slut free xxx trailers best body nude demi lovato cartoon porn girls naked in the water doll naked 
001	 call ugly whore slut piece retard autist cares lifes over 
001	 TruckerS63 WOW And I thought her amp I had a future Now I m devastated to find out she s a social media slut 
001	 MXV3RICK slut nI m jealous nI you nTell about it nI through life 
001	 bennjenkinz bitch looked familiar t co egeWSs3ppx 
001	Also take this image You a small girl fought with a large man on social media and he called you a slut you bum 
001	Ava Max is that motherfuckin bitch Sweet but Psycho is going to be THE NUMBER ONE HIT of 2019 Mark my words b 
001	Slut shaming disapproving comments side eye sass you won t find any of this in our community It s time to shed 
001	 live sites fucking video norwegian lesbians fucking other t co Ybw8s4Amyj 
001	 Downdayss don x89 t assume dresses anything she x89 s x89 slut x89 x9d x89 asking it x89 x9d should w x89 
001	 You know a bitch is a slut if she never met her father 
001	Fuck you BryceHall you bitch slut shaming bitch
001	RT ayeshody Dirty ass rat ass hoe ass slut ass crusty ass dusty ass dumpster juice ass bottom of the barrel trash bag ass bitch 
001	BDSM hardcore action with ropes and sex horny marijuana nsfw nude nudes nudetrade sange 
001	 and after still think she s y all t co soB2chd6Au 
001	RT ggukwashere me h my mutuals yOU LEFT ME ON READ YOU FUCKING SLUT
001	 Choose screaming about abortion Choose jokes slut shaming revenge endless depressing mi x89 t co 2WgMZjLjao 
001	 XxDanellyXx my little slut uwu get that mario kart dick 
001	mmmm i was full of cum snapchatsawitfirst pussy cum fullofcum creampie fan fans fanvideo ifuckedafan wet 
001	bitch do you not realize how ugly you look when you re a hating hoe appreciate yours smile you slut 
001	 stop fucking crying it x89 s deserve ungrateful little x89 t co dJO9h2UDsX 
001	RT oiaooy hell yea bitch dis go hard as hell flocka ill suck big dick team slut all day week month year and century i love big naps D I C 
001	 Pegging Cumshot nt co Qa77Gw8XM1 nlatina booty anime hentai black t x89 t co wm0W3GjU1i 
010	RT its khries Me sometimes I want to punch you in the face Ava I wish you would I m a kinky bitch Nah bitch you suicidal there is 
001	This is today s commute entertainment ethicalslut polyamory slut commute polygirl Audible audiobook 
001	Remember when Sohai Ali Abro was called behaya and a slut for Motorcycle girl But sure Rosie Gabrielle is our hero 
001	Why were girls so inclined to believe her and slut shame me I was 13 
001	hell yea bitch dis go hard as hell flocka i will suck big dick team slut all day all week month year and century i love big naps DICKSQUAD
001	Life s a bitch if it were easy it d be a slut 
001	RT richimochika RT and Like for more show porn camgirl f4f boobs slut cumtribute nike naked sugarbaby horny 
001	 definitely great slut shame exclusively follow camgirls across multiple platforms 
001	 how gently posting nudes she x89 s fucking underage I x89 m trying cons x89 t co HZg1fOwT6m 
001	 womens video naked grils sexting photo chinese lesbian t co f1q98NnSMZ 
001	 emperorsarcana invi and ava are two of the foretellers those absolute b stardes those dumb bitche 
001	 zssamus AKingNamedSimba grade aunt s drunk friend talking making pimpl x89 t co yG32oRNRpK 
001	RT chloethesiren How to be a Beautiful Woman Be thin Big boobs tho Prim and proper Total slut Also a virgin Boobs defy gravi 
001	anal blister old man porn free free young streaming porn hot springs porn girls cicolina porn asian getteen in bed 
001	 nophulintended sassy bitch t co tdxZaEbFKV 
001	miss ivy rlly though puta meant bitch when it really means slut 
001	Son give his step mother Shower Creampie Cory Chase 28 15 cum cumslut cumtribute cumvideo cumwhore 
001	with a drunk cassandra porn video slut girl porn bbs model non nude teen japanese girll nud emily 18 nude women hot 
001	me amp maisieGarcia10 passing each other in the halls me dumb bitch maisie stupid slut and we literally don 
001	Slut feminists using critical theory to intellectualise their shenanigans liberative desire meant the need of a 
001	 musclebitch78 Hi Sexy Slut When you do webcam 
001	It be so funny a bitch can be speaking on somebody to me amp I ll be like yeah she a slut they ll be like that s my 
001	He did the EXACT same thing to jesy and mocked her body and severely slut shamed the girls for weeks and now he wan 
001	Imagine making a video purely to slut shame girls let people post whatever tf they want 
010	 Peeeeej1Johnson thekjohnston Oh I get it so the object of the fat shaming or slut shaming is what makes it OK 
001	 shady bitch Nicki Minaj looooooves she x89 s about power shame Cardi possible NickiMin x89 
001	RT tiapogai51 she played with cum come out pussy gt gt register All for free Note Verify Email to send msg to girls 
001	RT chrisyouslut rt when you see your kink choking bondage daddy kink someone actually putting effort into a relationship public sex
001	 jynsuke plus bitches b boreddddd it s hard to determine if the pros outweigh the cons either way I support you i 
001	 baeklenciagas there literally kyungsoo dolls until fucker decided showed t co nlWQPs3fIl 
001	RT SandyGrave2 rt amp dm if you want nudes horny teen nudes booty tits ass pussy cum jailbait slut cocktease cumslut sex po 
001	Still blows my mind the girls called a slut a fat whore and fucks everyone from your man but they re the first bi 
001	RT bloomingBBH Jisoo is getting lots of hates cause she doesn t speak english and getting Slut shamed for performing Getting hate becau 
001	 slut anime cosplay hentai masterbating casting porno india porno indian lesbian dancing nake x89 t co f7AGt4gMcu 
001	RT THEBEST11985 I could get behind Tripp amp Claire but the need some conflict We were lead to believe that his crazy ass mama is still a 
001	 that fucking yeehaw bitch threatened really fucking nerve slut 
001	RT ChilledYT Febzey No I m am depressed Fat goth girl emo slut that posts stuff like i don t know what to do even no one likes me 
001	i need someone i can be nasty with like slap me amp call me a slut god damn this vanilla shit is boring
001	Sweet but Psycho is definitly that bitch Can t wait for more music from Ava Max
001	I can t believe that you loved that girl a lot Because we all know that she is a slut 
001	 naked videos pictures amateur asian worlds hotest pumped pussy movies t co McEqLz51BT 
001	 Porn Sex xxx webcam Horny Office Workers Ava Koxxx amp Sandra Star Have Big Breast Sex Threesome 
001	 pussy hot sexoengrupo hd granpolla morena milf jailbaits moan ass tits bitch chat teens girls hotties babes milfs 
100	 miachechik That s a well trained girl 
001	 lol funny these bitches against slut shaming quick judge fucked their favorite artist 
001	RT charli xcx fuck anxiety fuck anxiety fuck anxiety fuck
001	amateur teen model hot naked chicks on beach suck my black dick black fuck babe fist fucking mature blonde girls d 
001	RT Dey0naaaa really wish i had a homeboy to slut out bitches i dont like 
001	RT kar1naaguilar3 I m a slut for iced coffee amp redbull 
001	RT F00F1 Ava Divine gets her big ass fucked sex sexvideo porn pornvideo brazzers pornhub hardcoresex Pete pornstar 
001	bestfriend think he all that because he got a good username you slut breakupwyogf
001	Pop tht pussy bitch yeah she dancing like a slut
001	RT verxxity it s so unfair that boys can walk around wearing almost nothing and a girl who shows the tiniest bit of skin gets slut shamed
001	she shows her pussy on camera to her boyfriend help him self cum gt register All for free Not 
001	 unburiedchaos He probably walked out of the gym and called the first girl who wasn t interested in him a slut 
001	dream night where chopped knife myself thinking bitch Mulan 
001	 DarrenDommett Shes a fucking joke mate lmao shes gone to fight for the same people that have killed so many innoce 
001	 jesysmycure no i Pete Davidson is just a slut in general sksks
001	RT MeaAustin RT Follow if you want hot boobs in DM sessions booty boob camgirl slut snapchatslut cock nudes girl rt 
001	sheeessssh I am a SLUT for some riddim
001	RT blackcrafted a dom amp their friends walk in on the sub fingering themself stopping n blushing from embarrassment the dom tsks at their 
001	 Awh wittle thing about slut whore adulterer actor incest videos Don t b x89 t co qkvaThNzQy 
001	 Ppl about girls dressing sassy Halloween bitch almost don x89 t it x89 t co 0XIaukB2qq 
001	 sassy little bitch t co QtMbHIszxP 
001	 slut shaming other girls makes charlie boring t co wSx9qOp2ie 
001	naked nice ass homemade skinny mature pictures post op naked trannies nude indonesia girls picture naked womens fuc 
001	Harrassed by lusty fucking bitches whisspurring in my ear as I wake up wtf Succubus female demons that sexually 
001	 Ebony letting pussy after hornyruscom n t co oakRAXE69i stoya porn x89 t co m5u0kJ23ty 
001	Guys i m connected on loonyguitar wankchat xxx sexcam creampie slut pantyhose humiliation
001	I have spots open Sissy Slut Intox bitch Human ATM Amazon boy Do you have what it takes Can you live up to 
001	 kethschulz This nastiest skank bitch trust fugly slut t co 3pOaf7pgQt 
001	y all keep sharing that video slut shaming that girl when it isn t even cardi very weirdo like behavior
001	RT sef1029 If you dislike a woman for legitimate reasons please skip the gendered insults bitch slut princess etc English offers pl 
001	with girls XXX xnxx porn XXX Porn XXX british videos XXX forced sex videos XXX Porn XXX xvideos porn XXX fucking p 
001	 slut ashleyblossom Fucking webcam find6xyz n t co BFWrO4WEvW scenes online schmale jap x89 t co zEQhKE32X0 
001	11 After I m dead the filthy slut Cathy Dobie can take pride in knowing that she humiliated me into killing myself Ha Ha 
001	RT StylezBoogiee I d date the fuck out of me fuck y all 
100	Ava has the sniffles and a cough amp she s just wants to be cuddled I m sad she s feeling blah but I love being her comfort 
001	Society is so fuked like just because a girl wears a tank top don t mean she s trying to be a slut omg like we can 
001	In the past when a female rejected a guy the only thing she probably was worried about were some insults amp slut sh 
001	so funny when girls slut shame me and then tweet can someone send me 100 for no reason 
001	 Where daddy horny wants xa0 x89 t co BLXyzUW6SK 
001	 porn pussy spread scandles video enter email upload share t co 9jzKNV0Ak4 
001	RT mxtthewt honestly they could record themselves having sex probably both of them moaning in falsettos and whistle tones cut it amp slap 
001	In Vermont Florida girl the new slut In Florida band geek shitty boyfriend choices amp lots of friends 
001	 Maria amp amp Ayesa Blackwood short version n t co kIbSyYsteV pussy claudi x89 t co fHdAhZMcpa 
001	 facial cumshot cartoon white pussy ebony lesbians indian quick fucking lesbian quickie porn x89 t co OnrzJztSYX 
001	 fakerbetterforever crashbimbofication tightdenimgirls The ratio If she s not a slut then why 
001	ava max makes bops might fuck around and stan her 
001	RT isambekcrnmsk how to cum in side in the pussy gt gt Then sign up Note Verify Email to send msg to girls slu 
001	she is my bitch my slut whose big ass smells like shit i heard her call me at Toronto i licked her eyes 
001	 incest taboo teen slut porn Alex Coal Slut Stepsister 12 13 Next Part amp Full 
001	RT blogabtnothing1 My whole life I have been victim to society I hung around with my brother and his boy pals amp I was labelled a slut 
001	anal granny ava lauren facesitting happy tugs huge dildo japanese family lesbians old man fuck young girl amatures 
001	RT veryhotmomm men see a woman s innocuous twitter joke and comment shit like bitch whore cunt slut w no tits i wanna cut ur ain t shit 
001	dfuq kylie stop spamming ava with shaun chuchu we are fucking tired of it darn you mother fucking bitch pake mo b 
001	 partycitybitch Vitamin water will turn you into one of those really pretty self care bitches with nice skin
001	slutty skank Miss Ava is the perfect example of the totally kinky dork sexy 
001	hearing someone about their FUCKIN CHERISH OUTTA WHILE STILL HER 
001	 tentacle masturbating lesbian licking pussy great cumshot cheerleader porn x89 t co GQyBu6JL0e 
001	Lucky Stepbro Gets His Cock Blown amp Fucked By Slut Sister 
001	 campmetz Certain these bitches doing can x89 t justified don x89 t excuse being a x89 
001	fucking my wife fuck my ass forced sex videos Xnxx com Anulingus Porn Anulingus porno video hd mobil sunny leone 
001	RT curledbitch boys be in the dm s like hey hey hey hey hey hey hey hey hey wow fuck you slut hey
001	men only want equal rights when it comes to being able to hit girls back but bring up the wage gap or slut shaming and they go quiet
001	 porn celeb deepthroat cumshot fucked hugecock jessica drake unbelievable deepthro x89 t co mOWL3CoLmG 
001	Shy teen coed turns out to be a lustful bitch when stiff dick drills her damp pussy really hard PornTube 
001	RT ItsAlexJackson omg oh my gay tbh tiring bitching heterosexuals smh so much homosexual brb being really bi lol lots of lesb 
001	imagine getting a girl pregnant in high school then breaking up with her and slut shaming her to the whole school a 
001	 BigKissesApril wants video spazzing pussy dildo morning hor x89 
001	 Got interview Wednesday normal being sassy bitch work 
001	 numbseI They ll slut shame women but expect to look and dress like the girls they see on Instagram no logic 
001	RT pierian spring Telling a cute guy he looks like a Fuck boy is synonymous with telling a beautiful girl she looks like a slut If you 
001	He s a slut he s a hoe he s a freak Got a different girl every day of the week 
001	This girl is the nastiest skank bitch I ever met do not trust her she is a fugly slut
001	 TactMask Vibqh I x89 ll chopped bitch 
001	eating pussy ava addams porn flexy xxx facesitting orgy porn bare naked bottoms greek girl nude fucked 
001	RT nickccerino are you in a bad mood yes no bitch i might be
001	 this tweet is obviously a joke do not slut shame me you bitches 
001	I m the slut you hear about I m the bitch you dream about I m the POS you see out I m the cunt y all wanna make 
001	 jjanaria AlyssaSaidBye Your girl is a rapist who was chasing her rapist all over the world and you out here calli 
001	Me to Rocky I m sorry you ve never met your birth mom Mawmaw he doesn t want to meet her she s a SLUT Me MAWMAW 
001	really want a guy that will stop being a fucking slut for a min amp be my friend
001	ava lauren dora venter gloryhole creampie gym porn indian home made sex videos kristal summers squirting dildo watc 
001	 Perv fucked brunette slut n t co xmubbjzQZu sasha camwithher dildo fucking mental movies x89 t co 1idNQimb0L 
001	 maureendowd promote divide blame results person most understand completely yousuck 
001	If rework mercy doesnt work out for you just slut shame egirls Ez clout 
001	Redhaired japanese teens bathroom pov rt asian porn videos girls milf cam webcam dick gangbang slut 
001	Are you seriously okay with your girlfriend defending that slut Nobody is causing any harm to anyone I don t ca 
001	Fresh from a sell out run at Edinburgh Fringe harrietkemsley pulls her skirt out of her pants amp shames slut shamin 
001	If are you daiting RT for fuck amp DM for Blowjob Retweet amp like to see more Dating sex 
001	 jenicarosal Being sassy different being bitch 
001	RT ellebackwoods i can t believe kimberly almost 40 kardashian lip sync d to a song essentially slut shaming a girl half her age while he 
001	Greet first bitch slut n nMaybe dreams n nI never any n nFor real x81 t co uuzaQitBSb 
001	 eerika 123 friend slut whore it x89 s I x89 m sneak dissing that x89 s that x89 s bitch allowed to x89 
001	 Why friends think I x89 m slut I x89 m prude anything wtf 
001	 AdakuNonso This slut girl right here insulted our beloved Prophet Muhammad Rasulullah SAW on her timeline 
001	 gcfilms97 class slut facts straight bitch 
001	 umcornell business bitch t co wklp6Oo0ea 
001	if you think you have the best cumtribute then dm us an example of one you have done cumtribute cumslut 
001	 NsbSo would fucking bitch child swear t co qrXQo0cjEp 
001	Don t miss my hot XXX boy girl video Dirty Talking Fuck Doll manyvids dirtytalk 
