001	 hell bitch flocka month century i x89 t co ralx9fAevW 
001	 Enrique having girls sexting while back 
001	Obligatory girl I should cut my hair short again post that NO ONE CARES ABOUT JUST DO IT JUST DO IT YOU BASIC BITCH 
001	 amylovesnkotb JeffreyGuterman FLOTUS Nicklaus4Kids Classy Gold digging tramp who spreads her legs for someone 
001	one thing fosho bramin slut sinmai and her mother support bramin bitch not twit for karthik on zee tv judge but twit for kailasger
001	 Yes figured months amp jordan oxtails fresh amp chopped bitch right in x89 t co mPVJdvUZUw 
001	RT olesmeha86 He need me to eat his dick because eat dick it s my skill slut ass dick cock jailbait bbc gangbang cuckold f 
001	 extreme gangbang interracial swingers party party japanese sites women squirting je x89 t co B8RCX1lyui 
001	Sex Dating in your city Naked girls are waiting for you right now Adult Dating Co 
001	 DNIRAPD amp ain x89 t cause never texted slut 
001	It s always the good girls that have a wild side horny hotwife milf slut dm 
001	If I was a girl my technical term would be slut teamfollowback
001	 Sorry bitch thing offended always beetch stuff it x89 s habit oops it x89 s being sassy x89 t co TzaeTywaUX 
001	RT DollyOliver17 Some really savage and hot girls from your city here Sign up for Free porn pussy 
001	 X N00BX a hypocritical and selfish bitch who only becomes friends with people who want to commit suicide also a 
001	RT worldiegirls1 Small tits appreciation tittytuesday TittyTuesday boobs rate her 1 10 chav teenslag teenslut horny beachbabe 
001	I see so much slut shamming on the TL So it s fine if a guy sleeps around but soon as a girl does she s a hoe Fuck outta here
001	 korean japanese lesbian nylon internal cumshot incredible drunk amazing tits x89 t co ufVzMIsd7t 
001	RT if you d cover my pretty face with your warm cum jailbaitgirl jailbait amateurporn nsfw nudes pawg 
001	 Shanalee1982 I agree Why make it personal It s like people that call Notley a slut and bitch and worse There is 
001	can y all believe this is the same girl that slut drops during heat choreo 
001	 Amateur european babes facialized sexparty Freesexxgamescom n t co opWc1drbNn chick cumshot vide x89 t co AIclVG0uAH 
001	 girl caught masturbating hidden cumshot surprise machine pussy young blowjobs public mastur x89 t co V19jas2NW7 
001	listen very closely that slut momo i need you to my hat killing myself right now or you ll never hear the end of it mister 
001	 Hard girl bring water press braids everybody street gather
001	 explosism x89 Coming who x89 s slut x89 x9d 
001	 Xena nastiest skank bitch I x89 ve trust fugly slut 
001	Yuck Your white aunt amp uncle fucking sucked 
001	RT bitchkream Jordyn woods after a crackhead tries to steal her flat tummy tea at the shelter 
001	Bondaged chick likes anal creampie as sex slave nsfw orgasm wet horny pussy sex porn video xxx rt follow 
001	 clxireredfield Appreciation thread to my girl i know im a slut for ada wong but let s not forget this pure soul
001	Like and RT for more videos nsfw cumslut spank fucked her slut sugarbaby bj teen anal girl panties 
001	girls that slut shame other girls for having casual sex are actually so fucking annoying like pls go get some dick amp shut the fuck up 
001	 fist fucking unwanted cumshot indian porno cumshot surprise quick amateur b x89 t co 9WEBZsizAn 
001	RT ABlust09 DM me for some private fun like and RT schoolgirl cumslut cockslut snap slut cumwhore jailbait jailbaitslut kik 
001	RT zhongly also wanna say yall love slut shaming women like sorry sunmi wants to wear fucking shorts when shes preforming at a water fest 
001	 facial cumshot bulma hentai train deepthroat small pussy indian video double pe x89 t co nbJhVxEiBw 
001	ava rose busty milf extreme sex gf korean teen porn pegging riding creampie sharon wi tia sweets ftvgirls hot cunt 
001	 7am freestyle wanna dance sassy bitch kinda wanna throw homo 
001	ava was such a badass bitch why did not more people appreciate her like she kicked ASS
001	RT fuckankan begging is hot yes baby tell me how bad you want me tell me how much of a dirty little slut you are for daddy s touch b 
001	 incest taboo teen slut porn Alex Coal Slut Stepsister 13 13 Next Part amp Full 
001	 RehamKhan1 you are worst example of a slut You can sleep with any tom dick and harry just to make IK look bad Yo 
001	 XXX pussy GangBang mobil porno porno Porno Francias porno video mobil Dutch Sexpor x89 t co Ld6p5FjAFJ 
001	RT alexdransfeldt For anyone who needs to see this no don t cut ur fucking hair it s not gonna solve any of ur problems dumb bitch
001	 porn perfect porni casting naked italian girls women corsets donkey t co gK24VjMfEA 
001	 officialSmith swear being black bitch busted whole devotional after court t x89 
001	It s so fucking sad that girls sluts because that s what they are can chat about their ex s and bullshit but bitch 
001	 Slut shaming certain Halloween costume douche thing
001	 how gonna BIGGEST fucking bitch video vlives giggling compute confusion 
001	drunk women drunken ebony first amature blonde ho x89 t co 8YCfeJtloy 
001	I may be a slut but I ve said no before for example Some of the questions I ve said no to do i need a ru 
001	 That bitch f king slut t co O2Mt95bfKo 
001	everyone slut shames first accidentally second n np s comment x89 t co cWTurp5OqW 
001	drunk women drunken ebony first amature blonde ho x89 t co TM7yvY5MQY 
001	guess who was kissing another girl outside the school this fucking slut he s a slut even if he s a boy
001	send girl nudes and I ll send you mine sendnudes nude nudes snapchat girls boobs pussy horny slut 
001	RT LizOettle My long term friend ended up being a sissyslut and now he s My little bitch Welcome to the empire slut Let s get you si 
001	 eat japanese schoolgirl extreme fucking japanese cumshot untouched pussy fucking girls x89 t co 5gO7VknQJR 
001	 slut nicoleandadam masturbating webcam 6cambiz n t co H8SO7DR110 Multan nee x89 t co pYfw0F96Ml 
001	 Fuck honey yeah laugh called slut funny 
001	 Watch enchanted having brother room n n slut cumslut n xa0 n xa0 x81 x89 t co ZFPWtv9ppt 
001	Any girl want to help me edge cumtribute cocktribute hard wankchat cum cumslut whore slut cumwhore 
001	RT richimochika RT for more videos like this amateurporn panties cock teen nsfw webcam snapchat camgirl slut paypalwhore fuck me 
001	girl you gooood that doesnt make you a slut at alllll 
001	 Stop littering basic bitch t co wEzfwpcIhy 
001	This teen slut knows exactly what she s doing and she takes directions like a champ Time to find out what 
001	RT tatebutsu1983 Sex Dating in your city Naked girls are waiting for you right now Adult Dating Contact M 
100	 BonganeRay sassy njeri should identify nigga pregnant 
001	 btsblackpinksvt Sassy bitch couple Merciii x8f x8f x89 x9d x95 x8f x89 x9d x95 x8f t co YXqi299LVt 
001	drunk women drunken ebony first amature blonde ho x89 t co Y88UsEEKNM 
001	RT cheriexko dear boys joke or not you do not call a girl ugly fat slut whore and etc thank you 
001	 aviralrashtriya tejasrangnekar Guys plz help my friend Ishika Aggarwal A boy is abusing amp slut shaming her on F 
001	Yuck Your white aunt amp uncle fucking sucked 
001	RT dzhumshudsllpu1 Fuck me like a bitch my pussy is wet horny boobs tits pussy porn amateurporn nsfw cumslut blowjob sex 
001	 porn 21sextury drunk african francaise girls france t co TM5jAjJgBA 
001	 want bitch might around t co JNx8BLIKaj 
001	I need to stop being a little bitch
001	Someone is dreaming to being my slave sissy servant bitch or slut on NiteFlirt Call me at 1 800 To Flirt ext 11850182 to see why 
001	RT atlhoneyy Is that girl a slut or is she free and happy 
001	21st February 2016 Today a furry took me to a really nasty sim which was called PISS amp SCAT SLUTS of Slut Alley 
100	 shessoken Rushing morning slipped amp amp change pocket bitch x89 damn sonic good x89 
001	Just sold a clip Poisoned By Queen amp amp Little Slut Abuse Latex Get yours on iWantClips 
001	 immaterialxcx im doing something light cause bitch i bet itll be stuffy as fuck in there
001	yo having internet sounds so fucking hot rn i m a slut for modern day technology
001	 kahnaiyo When a guy s trying to distract from one of his heroes calling a girl in her mid teens a little slut 
001	A SisterOfMercyNun called my unmarried mother a slut amp I still ended up being Catholic OnTheDayIWasBorn
001	 AnotherLEOWifey I responded with something bitchy and that kinda worked too
001	 Webcam plays cumshot device shaves shower t co 6sSHx8ZXHH 
001	RT truly yrs i hate when you delete someone s number and iphone has the audacity to be like Maybe maybe nothing bitch
001	 TheCortnyLuna bitch audacity gonna awakening respe x89 
001	sleeping movies stupid drugged slut getting fucked girls with small tits fucking asian teen porn clip naked germain 
001	Ava s mans broke up with her and this bitch goes well there s other fish in the sea I h8 her 
001	Only time I call a girl a whore or a slut is when we talking if u get mi 
001	 Me nYeeyee assholes fucking bitch whore die 
001	 breadorno Thank u bread Ava still being a big ol bitch and won t even give me a drop
001	 Hot Granny gets a Slut girl for BIRTHDAY 
001	 diaper deepthroat cumshot black pussy blowjob videos oriental female masturbation compilation x89 t co MfJne8JLHs 
001	 girl loses virginity shemale fucking maltese adults masive t co gK24VjMfEA 
001	 Glory t co fpo4yN9kwB nimfoman babes mercedes Ambrus blowjobs american housewi x89 t co tHJMM7OCZa 
010	 Puig crotched chopped throat across bases I x89 d letthekidsplay 
001	 Yes I x89 m bitch because don x89 t you x89 re shaming someone wearing dress 
001	 trvpism sometimes stupid bitch that x89 s alright 
001	 yourgirlkami I heard Kami was a slut so I think I m good
001	If I m so much of a hoe slut dog ass bitch etc then why tf do this nigga insist on bothering me and hitting me 
001	mixes kannum kannum korthufy bitch pesify undress bahooth x89 t co ORcsjY9Bc4 
001	 StephanieSidley Yeah black chyna dated rob amp had a baby but a 21 yr old girl is slut shamed cancel the Kardashian s
001	 jisungssoulmate stereotypical looks gay sassy still sarcastic gay 
001	RT tiapogai51 Please come on guy register All for free Note Verify Email to send msg to girls slut 
001	Do you like my fat ass I want you to fuck me like a bitch RT Register and Write Me 
001	in my school there is this one old guy teacher who said if the girls wear liptint it means that we are sluts he l 
001	let me get this straight ariana sat down with piers morgan who blamed her for the manchester tragedy amp slut shame 
001	New sex video My Dirty Hobby Latex slut on fuck rampage porn xxx 3x
001	 Bro people assume whore because dress could b x89 t co wmjp43wgQO 
001	 dazzling European fucks camgirl t co T1PmNzJw9L 
001	Soo umm what happened to girls being their for eachother and not slut shaming eachother 
001	 hell bitch flocka month century i x89 t co qCFs8Syynr 
001	RT Nautanki Catty Slut If a girl is not ready to accept your proposal you name her slut If she accepts your proposal and after break 
001	this picture just slapped me on the face called me a slut and i said thank you 
001	Coming on twitter telling girls to live their best life and do their thing but slut shaming their enemies in privat 
001	RT karaikuge RT and Like for more anal wanktribute sugarbaby camgirl slut porn gangbang amateur girl wet fuckme 
010	 scp3008ikea I m gonna kill you whore slut
001	RT DiseloYahir I m a slut for stfu bitch you re just a slut
001	Fuck me like a bitch my pussy is wet horny boobs tits pussy porn amateurporn nsfw cumslut blowjob 
001	 SuperCroup Lol what a shameless slut he is Too many girls is a such a fake dilemma
001	RT cumsjk don t fucking tease me in public unless you want me to bring your ass into the bathroom amp teach you who s really in charge i l 
010	Fucking slut go kill your self o oh i guess i s should 
001	my name might b taemin s slut and that might give of strong bitch energy but i m awkward so please dont mind if i 
001	 Lovely Stoned pussy filled jizz n t co 5V09RssPLD piledriver cumshot compilation t x89 t co Y26bNNQNJJ 
001	 Margotigress redhead camgirl show fingering highheels wet dildoinpussy 
001	 icelandic virgin pussy swinger party massage penis cumming pussy rough polish cumshot s x89 t co K4qhSd8W4W 
001	 porkiusmaximus Big3Rollup joshnewberg247 Newberg being sassy bitch lol 
001	 More Vids gt gt Today in Brazzers History February 21 2014 VeronicaAvluvXX amp KeishaGrey wa 
001	RT iget loudtf Dick ain t worth it if it disrupts your peace Get better dick positive dick loving dick amp a dick that ll cherish ONLY 
001	 greek porno double dildo fucking public cumshot rubbing pussy masturbating eating young boobs kore x89 t co Ft5runXdtp 
001	on pokemon brutal anal creampie tube nude dance girl plays with her pussy naked girl in exotic water hawian girls a 
001	 DahmWhatsthat bitch f king slut t co O2Mt95bfKo 
001	 catwoman porno fucked vampire threesome masturbation party video x89 t co AEsGnnWyJD 
001	 Imma bitch dick t co wb2srESBmY 
001	 bitch sounds whenhe human rights feminism western concepts misinformed much 
001	anal squirt ava devine ava rose emo blowjob fat tits group fuck terri summers upskirt most studs tatto teensnow fem 
001	 handong pamyu Nooo byeee you don t call wonho a slut you slur go finger yourself to chenle tf you got my man and me fucked up stupid bitch
001	A sub wearing cute knee socks n a skirt on public accidentally the dom realises they are wearing nothing as underw 
001	 tweetwee15 Sassy bitch t co 6xKFbXZwDs 
001	RT foispildon30 He need me to eat his dick because eat dick it s my skill slut ass dick cock jailbait bbc gangbang cuckold 
001	 teen fucking dolphin movies porno squirting t co FPcxqCcxH8 
010	really wanting smack y x89 all daughters disrespectful sons 
001	 Watching episodes chopped bitch downs syndrome daughter lost bitch mom x89 t co ps6mlOeGjB 
001	 Chaturbate pussy fucking small boobs analed sexcams check con n t co 76jwQ4DSoM stuck x89 t co JDD1k9dDWg 
001	nichole stripper videos naked free naked photos of tna girls hot girls giant pinto freida porn hub aunt sleepover p 
001	desperate pathetic attention seeker slut trying to be me eww stinky ass bitch
001	I have a girl ringing me on no called ID calling me a slut Drop me out pls 
001	No one Ariana fans This girl is the nastiest skank bitch I have ever met Do not trust her she is a fugly slut 
001	RT suburbangrouse glennbeck Says the guy who mused about killing Nancy Pelosi amp Micheal Moore called Cindy Sheehan a tragedy slut ca 
001	 face quickest cumshot erotica women drunk fucked india pussy pussy young creampie video x89 t co rD5PgTTj0j 
001	 lyssburg or if my gfs are making poor choices ill say ok ur being a dumb slut rn bitch come on
001	ava devine deep anal dildo fuck machine girl on girl sex handjob videos pussy eating riding porn roxy deville sarah 
001	Skinny ebony slut anal creampied by three cocks 
001	 vip porno blowjob cumshot blowjob videos twerk hanjob uniform group videos cumming x89 t co IAyAP5oDJY 
001	Wednesday is here Retweet it spread the Wednesday joy trans gothgirl gothtrap mtf TransIsBeautiful 
001	Getting weary of my roomie inviting people over for the evening just to go total bottom slut amp take a few in the as 
001	 ReconNews that sandy ajfs71 The ReconNews SLUT has also arrived C U girls in a bit 
001	 You think cause saling pussy rapping bitch please always b x89 t co ATxZTdFjzQ 
001	 xcmula Hating bitch slayed press chopped hair 
001	 BDUTT Twitter No girl of any cast community or country deserve rape threats or slut shaming doesn t matter what 
001	RT BigKdawg095 When you walk in the party amp you see all the opps in that bitch 
001	 how gonna praise homies their count slut shame scold hers y x89 all no x89 t co f94ZgPbFGs 
001	 quick blonde reality kenyan indie breasts fucking girls lesbian arabic s x89 t co GiRUbHccs1 
001	 hiswife 9411 Tbh I m disgusted bc slut shaming women isn t cool amp khloekardashian thinks she s better than anyone 
001	fuck the freckles off ya face bitch
001	 RT and Like for more cocktribute tits spank slut cuckold cashslut lingerie fuck me hornyAF wet girl 
001	Krit Dan gt bloody cheap beggar slut gt just don t advertise my cup again
001	 x89 this white people time yeah today white bitch fucking feeding x89 t co SHPR8S92Bk 
001	 btsgiveaways10 Im done of people hating on you but who are still sending you hidden messages like bitch show yours 
001	Imma eat my next girl pussy way better then yours slut
001	 kj fetishmodel don t there s something about Slut tattooed ass 
001	watching a girl on their knees from the top when you know you re being the master and her the lil slut who just wa 
001	On the same note don t associate with men who say all women are bitches sluts So she s a slut just not with you Ok David 
001	Once Ava and I link it s over for you bitches
001	 anal cumshot indian lesbians squirting pussy frottage videos african korean x89 t co Sr3WFNG8Rr 
001	 Spidey Slut Can relate A previous partner s partner was highly aggravating but wanted us all to hang out all the 
001	 girl thong mobile video fucking sexting fucking black naked t co HfyWm1rkml 
001	 i killed a slut for this outfit me to my father
001	RT tatebutsu1983 Sex Dating in your city Naked girls are waiting for you right now Adult Dating Contact Me 
001	 MaKCouple underweargasm gayporncrushes new gaywanking Hotgaymen4 onlyXXXguys delet this
001	 watch korean porn babe girlfriend thai pattaya korean prostitute professional assfuck 
001	 poiselunacy just me amp go fellow slut
001	You are my little slut puppy princess babygirl You are mine Only mine
001	kylie when she cuts you off for being a complete and utter SLUT you don t even deserve love 
001	 drunk sluts teenage massage naruto drawn hentai cunnilingus indian fucked cumshot massive cumsho x89 t co DDjGp0mGNv 
100	can t anymore sassy bitch t co dPMNSEoTrP 
001	 Retweet wanna Cum n n hotwife horny slut Mistress milf slutwife slutty GoodGirls badgirls x89 t co RTdw2TI4Gv 
001	 LindseyGrahamSC realDonaldTrump You starting to act more and more like the bitchy queen we all know you are 
001	Y all stay boring with this Stalker Lizabitch is a slut mess 
001	Fuck me like a bitch my pussy is wet cum cock dick balls wank horny wanktribute cocktribute 
001	 kittycatmeow Bad bitches cant stop but we can slut drop 
001	sassy bitch x8d x8d t co 3IlgOQoZxE 
001	RT curledbitch u only have 10 to build ur perfect girlfriend thick 70 pretty 12 smart 40 me 10 can cook 100
001	 Cosmickatsu stands sassy bitch aaaaaaaaAa would look you re talking bef x89 
001	 issa jimoh Fiona another movie still slut 
001	 LOL dream about bitch chopped giving birth x89 t co RQ54Y9y24u 
001	Between Ava Krissy Nina amp even my precious Carly today there s seems to be a lot of dumb bitch disease going around PC gh
001	 Marvy jnr hell yeah amp she a natural slut bucket 
001	 nadu naked girls bondage alice cullen danza sexting mother nt co ay8ett3zCa 
001	 KIK lexievane happy slut porn adult panties pussy x89 t co PuJib1a0b8 
001	 Tribute Islandtime n t co noxKzp0NY4 brazzer cumshot brother video ai x89 t co 1wjJqhvRrj 
001	 sexxyysooyoung sexyjonie away bitch x89 Putanginamo t co RHP4bNMept 
001	If I was a girl my technical term would be slut teamfollowback
001	 1982 1984 born n1985 1990 Still born n1991 1993 fucking ever n1994 1998 Anxious pitiful x89 t co DquCjAkNv1 
001	I ain t a tric fake bitch keep ur clothes on My dad didn t raise a bitch Pay attention Don t be a bitch Bab 
001	 myronmom myself sucking dick slut t co NuQzjOcV4C 
001	college girl anal AbbyShiness Believe me when I m saying I m a true expert of causing pleasure to people I am gla 
001	RT PornoDan Check out Amazing Ass of Brill Babes brillbabesxxx Ava Black amp Over 2 000 Exclusive Scenes on for t 
001	RT sepgeydosfina Fuck me like a bitch my pussy is wet cum cock dick balls wank horny wanktribute cocktribute cumtribute 
001	 Sometimes wanna default dance entire fucking existence because much n nYou think I x89 t co jxIE0VGJwj 
001	 big tits milf cartoon CLICK HERE TO WATCH ass fuck ava devine 
001	RT AnieBargeman OMG The way she penetrates herself is wild Click here boobs nude nudes milf blo 
001	RT manisnasa tbh you bea n aaden are my most favorite bitches in the world even if y all are sometimes annoying i fw u 
001	 LalaTopher mooch 19 JeezyU Shut up always jacking kills after I ve tagged tf outta them lol fckn slut
001	 You bitch SLUT t co Xw0cy4DwAa 
001	 horny slut pussy dm me girls and guys send me nudes first and I ll send back 
001	 porn riding gapefarting argentina australian japanese lesbian massage rebecca x89 t co 7etq6yMZOZ 
001	 Sensual talked having t co aOLpbzVCaD youngteensmovies egyptian whore video x89 t co eYPWp2Rbg1 
001	RT semiratchetness Chantel needs to never cuss again lmfao stupid ass slut ass bitch ass whore LMAO Whoa I never cringed so hard 
001	 420Typhlosion69 porno where getting fucked she s really calls s x89 
001	 milf creampie gagging worlds biggest cumshot college rules girls korea black pussy flick x89 t co AZSg4pVSDr 
001	 Fuck people repost yourselves supporters women slut shaming and x89 t co 87G1LAUYWS 
001	 spider slut FUCKIN WOULD EXPECT THEIR MONEY AFTER ACTING YOU RE GROSS JFC n nBleed dry 
001	My cashapp is aritaylor428 pornhub brazzers WSHH girls boobs ass twerk assclap fatbooty booty nudes 
001	RT Bigdicktyrone4 Any horny girl want to help me edge cumtribute cocktribute hard wankchat cum cumslut whore slut cumwhore dic 
001	Gym addicted babe has asian creampie pussy nsfw orgasm wet horny pussy sex porn video xxx rt follow 
001	 smilinggetsmeby stopped seeing around y all quote tweet everyday week n nLet bitch scr x89 
001	RT goeshira1987 Free Sex Dating in your city Come in the girls are waiting SEX Dating Contact Me htt 
001	sexually videos pornos dirty pictures lesbian t co 1xkq4vaMNP 
001	movies naked contortionist video screaming black girl ultimate orgy video homemade anal lube video hot slut anal se 
001	night fucking XXX Video Lesbiennes Sex Anal XXX Lesbiennes sister Sex porn XXX sister porn Sex fucking videos XXX v 
001	I m a slut for some good R amp B
001	ava max is a fucking queen bitches you better listen to her music
001	 find6xyz ashlyeroberts flashing boobs webcam n t co bcf8k7G6zd xxxsexy deshi photo marx x89 t co JM9mDAFsor 
001	 KasiaMitchell don x89 t sharing PERIOD friends included bitch 
001	 saulter01 Ken723Ken Firstly suspect raped niece that x89 s conflict interest s x89 t co VoOtcVw5jS 
001	 killfoood She s such a cheap bitch Since when do we dress like a slut on the red carpet Shows her status pretty well
001	RT edward420hands bitches b like the fit n its ripped jeans checkered vans amp a fuckin PINK jacket
001	RT AydeeNayeli i just might fuck around and make a couple bitches mad
001	 Big jerkoff cum n t co uaWvUtRIyN cumshot videos russia skinny tits x89 t co lKiWUEu2yT 
001	You call her a slut a whore and a bitch But yet you were the one who dated her 
001	RT TeresaSlut Message me if u can do a cumtribute right now cumtribute cumslut slut tits hotgirls cocktribute 
001	 wife orgasm nipple movie docking massive hentai dragon creampie teen x89 t co 01vNCO2Efg 
001	RT LidiaHot 18 I m a horny little bitch you want to fuck tonight do RT Register and Write Note Verify 
001	 porn blacksonblondes small black milfs massive cumshot missy stone redheads black lesbians usin x89 t co RPElnjCXXc 
001	RT KingGriff 10 Lot of girls that bitch about men men haters are 100 lookin in the wrong direction and some of the girls too a 
001	Let the fucking terrorist bitch rot in hell or better still behead the lying scheming slut just like her husband and friends have
001	 reneejess0205 Slut dog shes a diva 
001	Being able to say bitch slut hoe etc during rough sex makes it better 
001	 Bro can x89 t looking slut 
001	Silvia slut from Holland Everyone Silvia ugly fucking old bitch from Swe Everyone massive booing 
001	 antique cumshot lustgal preteen blonde bangbros abused babes school guarreridas torbe mariajesus c x89 t co UFUi3N5lat 
001	 degrading hi call me ur slut amp tell me i m pathetic pls
001	 corin evans ianbestard SB Hearfield ChazzerT GB Any other girl just LOVE it when they get called a little slut by their DADDY 
001	 pussy ass nsexoengrupo granpolla morena milf njailbaits bitch teens girls hotties babes milfs x89 t co CBKkeljhD9 
001	wanted murder through Naruto Naruto Shipudden Fucking whore skank Sasuke dick t x89 t co UigNhwLnc4 
001	 Hot fucking BF n n tits cock cumtribute nude tradenudes horny cumslut cock tits x89 t co 2XzLGU7ddt 
001	Diane get ur ass off the fuckin bed and do ur errands for today u slothy slut bitch
001	I can turn a church girl into a stone cold slut 
001	 camsex 324 n t co Z3qrnoJwJf frinch Moore cumshot teens bitch amateurs ca x89 t co MABvrH2ASc 
001	 starting patricia more HAHAHAHAHAHAHAHAHAHA she s honest sassy bitch
001	Girl milika is a whole home wrecker amp Kim is a hoe I know they not slut shaming jordyn This his 3rd time cheating 
001	RT dsijcheng hey bitches rt to be in a kpop gc be a bad bitch dont be problematic dont be sensitive tbz skz and nct stans ez acce 
001	im a slut for chicken salad
001	 Soapy Massage Cumshot t co BB5o53A3He snake fucking pattycake online har x89 t co UDdTsJ59O5 
001	 People short memory loss Steffy slut Brooke HoGan isn x89 t que x89 t co i7LMAapoxC 
001	Yeah I m a slut but I ve killed someone
001	 video gautemalan photo naked girls likes picture booby naked bengali t co Zp1xp3FSIs 
001	 Smileygirl19681 It s all about the money him and his slut daughter are all over the shop atm They are scum 
001	 milf mature cumshot compilation ebony licking pussy flick shagwell young swingers masturbating x89 t co Jw2jnsdytZ 
001	Call me flirt slut hoe bitch whore idc 
