001	pics mexican school girl naked melanie safka fake nude photos hardcore slut movies alicia moore porn star toon love 
001	 girl dirty quarterback latino pokemon young handjob kissing gangbang w x89 t co Wrm4xo00vJ 
001	 miliondollameat sexting n ngirl daddy n nme listen bitch gonna watch these what 
001	 museum slut If you know somewhere we can do it THEN I AM GAME
001	RT sp00kybitchhhh I have spots open Sissy Slut Intox bitch Human ATM Amazon boy Do you have what it takes Can you live up to my 
001	 venus astrology living standards nIt x89 s illusion I x89 m fucking nWaiting waiting WAI x89 
001	add me on Snapchat and watch me cum coltoe8 sendnudes nude nudes snapchat girls boobs pussy horny 
001	RT olesmeha86 He need me to eat his dick because eat dick it s my skill slut ass dick cock jailbait bbc gangbang cuckold 
001	RT tiapogai51 Please sleep i will do it for you guy gt register Note Verify Email to send msg to girls slut 
001	RT nsfw bitches Imagine your cute little sub on their knees sucking your cock softly They bat their eyes and stop sucking You grab thei 
001	 MULTlEXO can t bitch t co gWhiXGdZx8 
001	 Reality prozzie mouth n t co FQb3nyiTP1 underage cumshot movies bustyhardcorebabes european girl x89 t co VskCtsyQEO 
001	 PaigeMcMath you re still slut brain automatically tweet me 
001	hey bitches rt to be in a kpop gc be a bad bitch dont be problematic dont be sensitive tbz skz and nct stan 
001	i prefer guy friends than girl friends im not slut or flirt but i feel more secure when i m with my guy friends feel me hahahaha
001	 kalysta beaver hoe slut shaming other girls low talking about people 
001	 Patii Fittii sassy bitch t co nCXul52Z86 
001	Allow people to be happy If a dude or a girl decides to be a slut wtf is your problem Certainly not your ding dong or cookie jar 
001	 Straight friends amp amp fuck n t co bUw5RaE0Pp aadivasi fucking sucking breast xx x89 t co ponZGj6wis 
001	RT computer screen Im a whore for my job a big slut for it I love it and i love getting fucked by my trabajo Shes sucha bitch thinki 
001	 PerezHilton I knew it and I called it when all you bitches ya ll all said he was a MAGA victim I knew he was a 
001	 femdom unexpected cumshot virgin escort lesbian sisters drunk young anime fuck x89 t co xXW8fr7Kk1 
001	RT blckexcelllence Y all a white girl from my school fucked a dog and posted a video of her doin it on her Snapchat story 
001	 lesbians tribbing latinas porno celebrity fucking uncensored hentai first ce x89 t co 964XMPddzx 
001	You would like that uh babygirl Your moans and your whines echoing in the bathroom as I finger you in the shower 
001	RT LKing20569301 charliekirk11 This Kampala Harris She really believes that she has a chance because she is a woman Blackish and a slut 
001	RT ilovechronicbud Do you ever get mad at the munchies I ll be overstuffed and bitching that slut little Debbie is always seducing me 
001	 SpectatorTM time bumper sticker Slut life the x89 t co OEJIhW7WWm 
001	 baddknews nigga can x89 t nomo gettin chopped 
001	RT tany vander fucking my wife fuck my ass XXX forced sex videos Xnxx com Anulingus XXX p XXX Porn Anulingus XXX porno video hd mob 
001	Ava devine u bitch ass slut where da fuck is my fuckin money u god damn fuckin bitch
010	 deepthroat cumshot perfect boobs jewish indian pussy naked lesbians japanese beaut x89 t co gFwxstN2fk 
001	RT nctcandles Is it ever okay to use gay as an insult Ex I hate that teacher so fucking much shes so gay like yes rt no tryna 
001	My bitch think we breaking up LMAO stupid SLUT ill kill you TTYL i love you
001	 lillydelben you x89 re cause stole pussy enough back ain x89 t ain x89 t x89 t co 9JHjbOaPfG 
001	 archive19424198 trees animals flowers i m going for a pastel 80s georgia o keefe golden girls country slut look rn tbh lmao
001	 nina bryce22 Regardless of whatever u ask me the answer is YOU decide I can call somebody a bitch slut or a pu 
001	 YaraNazar slut shaming mostly comes females matter female to female issue 
001	Good morning nudes cumwhore venmo sugardaddy sugarbaby horny ass youngteen schoolgirl cumslut tits 
001	 Cute glasses porn cumshot tits t co wDAS8dI6Zg 
001	 ArianaGrande girl as long as you don t think he s a good person or sumn just bc he didn t slut shame u to ur face we chillin
001	Ari the perfect example of a slut you hoes go to a new dino in a matter of months n still try to fw yo ex on top o 
001	 You re bitch x89 slut better too t co rti1vp1xED 
001	 InMyCudiZone People short memory loss Steffy slut Brooke HoGan isn x89 t queen of x89 
100	The people that work in the dining hall are all sitting here talking shit about this girl that came in first thing 
001	 DanielsLiving Not a slut just experienced 
001	 hell bitch flocka month century i x89 t co aAngtAg4Lb 
001	RT tiapogai51 All these man are very lucky gt Then sign up Note Verify Email to send msg to girls slut ass dick cock jailbait 
001	naked sexy mature interracial anal ho aberdeen slut gets fucked by teens monkey and teen sex amateur movis scenes a 
001	Do you want to eat my pussy I feel very bitch cum cock dick balls wank horny wanktribute cocktribute 
001	 bansheerabidcat not alfonso Oh pay me na slut not alfonso lt 3 charot lang 
001	If a girl bangs 10 guys in a year she s a slut But if a guy does it he s gay Definately gay 
001	 nocturnkisses daddy s gonna wreck punish being naughty naughty little slut 
001	 t co xdtAIMBPY5 n npornstars juice pornstar cumpilations 21sextury cumshot nippon movies games po x89 t co Z2Crzbi0UJ 
001	 evajunewilliams blairedaily found about Wasn x89 t shaming bitch shaming 
001	 smalltownandrew No there is a combination a tax cheating son of a bitch and a racist slut 
001	RT lucas bethany Quit bitching bc girls post pics w their ass on the sink Quit bitching ab how much their clothes cover their body 
001	first today ALONE because cousin nastiest skank bitch i x89 ve DO x89 t co 1Np4kdzOnv 
001	 Jus stop masterbation bitch masterbation life x9d don t h x89 t co tH1fy3T6XF 
001	 crucialstates pussyliquor the menstrual cramps peaness the tuts daddy issues grlwood doll skin witch fever 
001	 Move little you re taking attention slut t co J8qsCa8ku9 
001	RT austin schmitty Mother fucker bitch slut whore fucking fags Brb gonna try girls for a bit
001	women doesn t adhere sexual norms called slutty perceived sexually acti x89 t co oXQ4TJKk1L 
001	 trulybbh isn t slut x8b she s EXO L n n iHeartAwards BestFanArmy EXOL weareoneEXO 
001	 maannyyyy Everyone bitch actually everyone unfollow watch bitch about 
001	To my niggas having bitches it s what you just do to the bitches having niggas it s what a slut do My aunt told m 
001	a reporter with a penis called a girl slut coz she was wearing what she wanted to wear haha good thing that woma 
001	1 I got Thanos Die bitch 2 Whoever made this is a monster Tony is born in May and Peter is born in August y 
001	 NostalgiaShe 500 singles and slut bitch is my shit
001	 Kayl Donald Ava s been coughing to fuck as well for months they told me it was a chest infection turns out she s 
001	world Halloween night dress total slut other girls sa x89 t co 7hDprpneQm 
001	 British pussy cumshot indian stars uncircumcised hours ago x89 t co C6yyBtpOMV 
010	RT DebbieD74799118 SteveD4848 How dare she Honest people and children were killed in Manchester and this scum says that s fair retali 
001	 MarkiaaG Bitches wanna friends niggas homies bitch ain x89 t wives don x89 t wanna
001	I can t post a comment saying must be nice to be a slut on a picture of a almost fully nude girl showing her as 
001	 RT and Like for more anal wanktribute sugarbaby camgirl slut porn gangbang amateur girl wet fuckme 
001	 pawgslut CumshotsVids Such a good girl 
001	Pervy guy fucks Eva for dirty creampie in HD porn nsfw orgasm wet horny pussy sex porn video xxx rt 
001	 Transgender people stupid vagina biggest ever wouldnt makeamericasmartagain 
001	concurso porno japones go girls nude nylons stocking colombian slut what is the best free amateur porn site petite 
001	I feel like a slut because I thrive on twitter but they killed vine
001	Ava Addams getting fucked by big black cock 
001	i licked her legs and it was like her hair we listened to radiohead playing on the radio she had two cigar 
001	 British pussy cumshot indian stars uncircumcised hours agoRakel Liekki x89 t co WSvORe2qPU 
001	 miamischievious PaulPromotes Natuky85 AdultModelPromo Tattooed Babes FANCentroTribe CamAngelsXXX rtslave 7 Such a naughty girl
001	Hidden camera in the toilet gt Then sign up Note Verify Email to send msg to girls 
001	i let a guy with a camaro take my virginity and dump me for the community slut amp now hes ignoring my existence so w 
001	 xa0 npussy amateur adult women nporno snapchatme hairy xxx nsnapme x89 t co p8tWyGOzAV 
001	RT CFootGoddessx Your balls wouldnt manage under my huge feet pure toture to you little cum slut foot slave bitches humiliation hum 
010	 PraetorSuit Which specifically I x89 d personally pitch black world devil there rapist an x89 t co bUrgtjfryA 
001	RT AmberCa10937197 Wanna meet a really sexy bitch for a good evening free signup porn dick webca 
001	RT romyboekman People like to virgin shame just as much as they do slut shame Girls can t win either way 
001	Selling my dropbox now pm me only paypal kinkygirl slut slutty fuckme yesdaddy daddy sugardaddy horny 
001	one thing about my TL u gon get the minds of a kid a teenager a girlfriend a desperate lover a wife a slut 
001	if you are insulted by me calling you bitch slut hoe or any term like this then PLEASE leave my account
001	 incest taboo teen slut porn Alex Coal Slut Stepsister 01 13 Next Part amp Full 
001	 tbh you bea n aaden are my most favorite bitches in the world even if y all are sometimes annoyin 
001	I did say from 5 months ago that Ava Max is gonna blow up thats so raven who bitchs
001	I m tired of fucking these lame bitches I just need a slut 
001	 pussy pussy pictures naked pokemon movie geeky nt co ZwVjmUXJH0 
001	DM me for some private fun like and RT snapchat schoolgirl cumslut cockslut snap slut cumwhore jailbait 
001	Lindsey Graham s slut whore drunk quote about victims haunt his x89 t co KlBYJBugqS 
010	sassy wants signing first prepare good don t know x89 t co qiQGIb17IK 
001	 porn drunk england interracial threesome iranian karina sapphic soloboy fuck x89 t co 4LaVCI5pZR 
001	Me jamming to break up w your girlfriend Chris honestly this is the slut anthem Me I know right I fucking love it 
001	 luna yumizuki gotta focus study thinking useless shit n nme n nme n nmy brain bitch flo x89 
001	snapchat xfoxygirl n n nparis unwanted creampie russian threesome indian porno cumshot nake x89 t co pxCKZy763Z 
001	 give coochie homeless dirty bitch x89 thank t co 6TywHqdNSA 
001	Is that girl a slut or is she free and happy 
001	 itsgodgabitch ava has all of those and loves Gaga too what s with this random slander huh why do you need to pit 
001	 wasnt bitch locked dropped songs t co 3cbWLcKCTu 
010	 bbadicali sarcasticfem23 MsVanillaRose facebook habitually harass calling addicted druggy hooker for x89 
001	RT letitbeglorious she served so many looks in this video Check On It really is that bitch 
001	Dudes really be slut shaming IG models famous chicks and thinking their girls are perfect angels 
001	ava lauren dominatrix first time fucking group india sex video kira kener lesbians videos oil ass orgy scene porno 
001	 Facial Cumshots Nasty Hardcore Gangbang t co psZJ0AuWjA daddy cumshot little story fema x89 t co clZGi0ccBG 
001	 porn naturaltits swinger cumshot hiddencam mature ladies missy monroe schoolgirls tight uni x89 t co csIdxzot8C 
001	rt dm slut boys n girls img20plus
001	 love you bby RT and Like for more girls cock cuckold cum dating dm hardcore milf naked nsfw nudes p 
001	Hot Anal Double Penatration Ava Devine Dirty Girl blowjob assfuck bj milf anal cumshot faketits 
001	RT scarcexbitch 368 love ur tweets w ava 
001	 movie porno masturbation comics porno outdoor handjob granny fucking casting gaping pussy cas x89 t co wsE6lHf57F 
001	RT ratalburo17 Fuck me like a bitch my pussy is wet horny boobs tits pussy porn amateurporn nsfw cumslut blowjob sex sl 
001	secretly recorded black Tasexycom n t co kGoMzdJsD2 black fucking habesha x89 t co RsdluQRjfD 
001	Wanna unblocked the stupid slut from mixer I can will block her back idc if I m being petty or not She bitch disr 
001	 finalcybergirl I should stop calling you a slut
001	 andreaaa666 AlexExamples I called you stupid slut and spit on you don t fucking lie bitch
001	RT ZoieSorensen If a girl with no tits posted a pic wearing a plunging shirt everyone would be talking about how cute she is but if a g 
001	 I x89 ve hardly tweets x89 slut shaming x89 x9d Alissa Violet towards Shane Jake Shane liter x89 t co svtCCc4Bzs 
001	 AjHuncho Don x89 t won x89 t bitch broke x8f x8f x89 x8d x89 x95 x8f x8f x89 x8d x89 x95 x8f 
001	RT iamwytunes Niggas think a girl with a baby is a slut but your mom who is a single mother is the strongest woman alive 
001	And I got what A fucking son bitch but mfs swear ima slut amp what not 
001	 japanese amateur italian porno handjob longest cumshot cartoon crempie drunk fucked retr x89 t co kHS0vsJTKr 
001	 makeme scream01 It depends At the beginning I like kitty baby Once I approach my climax I love been called bitch 
001	 velourhood MasonSchreinerr Just watch gossip girl amp act like Serena amp you ll be a slut
001	Female Overwatch player h Every other team member fucking slut get on mercy you bitch c nt didn t know they coul 
001	 What kinda skeet bitch every rapper sucked every rapper dick t co Av0UCCxdSN 
001	 Don t slanderer worthless guts ya slut 
001	RT Elizaporn Wish you can cumshot on her ass Retweet amp like to see more Full Videos Contact me 
001	RT oldabzuka62 Do You Deserve My Ass Retweet amp like to see more Full Videos Contact me 
001	 mads penelope alice dyke serpent slut i x89 m going co x89 t co WdpaIlMmBK 
001	 Sceeterrr Behind every sassy bitch there x89 s whose repeatedly with 
001	RT VanessaBorusse You jinxed the whole fucking champions League you slut 
001	also not to be a soft bitch but i miss that triple scorpio slut from melbourne a phat amount lt 3
001	Any girl wants to be my master and tell me what to do Slave cumtribute Cocktribute mistress goddess horny 
001	RT tiapogai51 A long pines with her pussy gt register Note Verify Email to send msg to girls slut ass dick 
001	 This through trouble following watching story DMing harassment slut sham x89 t co 8PrLK3ylXX 
001	photo grid girl slut free xxx trailers best body nude demi lovato cartoon porn girls naked in the water porno sri l 
010	hot British slut Crissy will give you a wet dream when she rubs on her pussy camgirl 
001	Big tit Party girl Ava Joy gets fucked in the club Reality Kings 
001	 chickmiko would doesn t spell SLUT 
001	Get you a man you can make you laugh amp smile but also one who can make you moan like the little slut you are 
001	Shemale Eva Lin anal fucks MILF pornstar Ava Devine 
001	RT ToniTimeRP Hi there real slut Come and suck my dick and get your cum Gotta ask my girl for permission if i can 
100	I will never understand how girls can slut shame other girls for having male friends 
001	Dear girls with ur shirts to ur bellybutton amp amp shorts an inch long u aren t beautiful u are a slut Sincerely Eve 
001	 lesbian sisters massage indian defloration videos teens amateur allure drunk blow x89 t co AZXXedCHaK 
001	RT FloppyCrater892 That one white bitch coming in the middle of class looking for her hydro flask that she left 
001	 they bitch homewrecker slut manipulative cunt golddigger but never t co ssLgwv4SKM 
001	RT DevanRei all these lesbians fuckin with boys these days 
001	My baby mama is bitter evil triflin slut and a bitch 
010	 The woman brutally tortured minor servant starved MAJOR AMMARA m x89 t co Yj96d2XgRP 
001	Some about college it bring the slut out the girls watchtheyblameitondiquor 
001	 you can x89 t finsta shaming girls weird 
001	 granny lesbian indian hentai tentacle tentacle hentai sounding pussy masterbating x89 t co bGiov9TvtR 
001	RT marthhabsmaza1 Hot horny sluts amp models online 24 7 amp join 100 FREE blowjob sex slut ass dick cock j 
001	 still believe people slut shaming dancing instructor huh 
001	Ava Divine gets her big ass fucked sex sexvideo porn pornvideo brazzers pornhub pornstar 
001	sister bitch thought robber something house selfie stick a x89 t co RzIIC8BCe1 
001	 etdragonpunch When I was 21 22 I was a slut There was a girl 19 who was a fuck buddy for a while and one week 
001	 skinnyhealy i x89 m having listen people fat shame slut shame round about people x8d can x89 t fuck x89 
001	Britney turned me into a slut 
100	 shylerlittlee honestly can x89 t relate girls shame different every weekend fuckin 10 x89 
001	sexist slut shaming is not an example of marginalized SJWs it s actually male right wingers
001	 DKamp1997 she s gonna be a great slut
001	 spider slut private doesn t going effect grades The x89 t co iRLK8twwZ7 
001	menis porn black man sex white woman chinese slut mture porn movies rachel roxx sex videos hot amateurs rassains fr 
001	 Why are you a Darwin Partner when you are shit mechanically and can only kill people by cheesing them Who s dick 
001	actually drunk bitch Tammy talks talk tr x89 t co MKUoHOMxXO 
001	Girls who slut shame other girls are usually just jealous Nothing wrong with being a slag it just means you can get a man and they cant
001	 Sudsy Slut Tylo Duran clip 19 n t co fnDyDt2oZb Rockiroads hardcore beasty mature m x89 t co gTg2uHAd5U 
001	 first movies pussy pussy latina upskirt drunk cumshot japanese squ x89 t co d6sQ7e4wLN 
001	seeing a lot of cool account names today that are fashion label sex toy whore slut for example Dior s Butt Plug 
001	Lol Bring up dying And the team lol Youre lookjng back that far ahahha yourr a bitch thats not what wouldve happen 
001	No you stupid dumb clueless bitch you don t get to determine who is family and who is not family fuck off you dumb slut
001	These dykes taking all the slut bitches 
001	 sassy bitch liked t co MMY2PKl1I2 
001	 Cumshot Delight t co kwk0bx2fNm glamour cumshot hay x89 t co i9p299dNgU 
001	RT dickadillas fuck all you silly bitches who told me to stop wearing heels in HS lol bitch is still wearing them but on the damn runway 
001	with a drunk cassandra porn video slut girl porn bbs model non nude teen japanese girll nud emily 18 nude naked ext 
001	 skynewsniall Kavanaugh tweets because supported Professor nicest Slut x89 t co FRjn4v8TjV 
001	 lol shaming after don t gonna outside pussy when x89 t co hgLb7MfIV4 
010	 P0RNSFW Daddy behave baby daddy tight open yeah little x89 
001	 incest taboo teen slut porn Alex Coal Slut Stepsister 00 13 Next Part amp Full 
001	RT MishellHot17 I am so horny right now Just want some hard fuck RT baby Register and Write Me Note Ver 
001	 Young fucked screams n t co 6p0CNdL6LC using dildo Ranipussyphoto brittanya ge x89 t co w3RfmugGqr 
001	 porn fever busty downblouse heels jasmine handjob party video x89 t co 10wNuAsVBT 
010	What I don t get is how y all try to drag Becky for body shaming Charlotte when she didn t but laugh at a fan th 
001	RT PyxisFoxx In the past when a female rejected a guy the only thing she probably was worried about were some insults amp slut shaming now 
001	My daughter likes Creampie Studies nsfw orgasm wet horny pussy sex porn video xxx rt follow creampie 
001	Its a wonderful feeling to know that when a girl reveals she s a slut to me and i unfriend that bitch vice versa to 
001	 porn hardcore drunk lesbian slave michelle cumshot videos amateurs wasteland cana x89 t co 3ms1bZG8j1 
001	 feetloverboy121 Tribute amp dm to be considered slut 
001	she need your cum come in side her pussy gt gt Then sign up Note Verify Email to send msg to 
001	 Priyacamgirl Ankitabitchy anusharmaloveu sexynavel hottyonbed Nangu69 sluttyx1 sexobeast Pussycat oo 
001	RT dickadillas fuck all you silly bitches who told me to stop wearing heels in HS lol bitch is still wearing them but on the damn runway 
001	 massive cumshot lesbian massage squirt hands extreme nurse rough lesbian x89 t co 0iCFaCxYXZ 
001	 SM00CHESS y x89 all better x89 slut x89 x9d jokes homophobic jokes downey warren beef childish 
001	i m just a simple girl who wants to be wined and dined and felt up under the table in a nice restaurant like the slut i am
001	Oooo lots of slut shaming in his dads sermon I m uncomfortable
001	RT VampMoney4ever when rocky fingered my asshole I was like hmm dis some gay shit but he was doin his thang an so was I so I 
010	 x WildestDreams really being sassy twitter t co btBlszxBw0 
001	Life s a bitch because if it was a slut it would be easy 
001	RT Goddess j8 Open wide slut Wallet amp mouth findom goddess domme financialdomination humiliation exposure blackmail rtgame ch 
001	We goin RyanSiggins zechcastillo ky6ka Shep 72 amp djgavinflash the projectile slut 
001	Lol fr tho im so happy the quirky im not like other girls because im a tomboy and not a slut give me praise type of girl died out
001	 Demon bendy 5 More like the bitchiest hedgehog asshole slut
001	RT iamsidb can t have no baby with no slut bitch freak dancing
001	Piers Morgan slut and body shamed little Mix but can t take it back Jack Whitehall made the comment not the girl 
001	 Need horny young cock boobs tits bigcock bigwhitecock dmme cocktribute nudes x89 t co 4qsTdF4VMd 
001	RT Laaurensherry Girls that still try to contact lads when they know they are in a relationship are the pits Slut x
001	the bitches that go around talking about women are the same bitches that slut shame others for no apparent reason 
001	 You like that bitch You re such a sexy little slut You like being a little slut Huh I know you re a litt 
001	 Son bitch it n t co 5xiZl5Gren 
001	ALL RISE FOR THE WEEB SLUT ANTHEM Anarchy Panty amp Stocking No Beep Ver Download Lyrics in Descrip 
001	 italian night czech oiled fountain unwanted cumshot manga porno drunk german porn x89 t co wbdk1Z9Lhp 
001	RT glossytartan y n zayn in a 1D fanfic after he left the band fuck u u stupid fucking bitch slut dumb fucking stupid ass cunt im goin 
001	RT rejibangi Like and RT for more vids jailbait balls horny slut boobs amateurporn adult nude nudes camgirl lingerie 
001	 hughriminton billshortenmp Bill is going to behave like Dutto s lil slut Let s look at carbon cost amp resource of 
100	 thekatiedrennen Katie is totally turning into one of those girls who gets married and forgets two years ago she wa 
001	 goldenjorgeyy Shut up bitch don t call me out like that 
001	Sex Dating in your city Naked girls are waiting for you right now Adult Dating Contac 
001	im a thot im a bitch im a slut im a ho but most of all im me 
001	Ava devine u bitch ass slut where da fuck is my fuckin money u god damn fuckin bitch
001	 DanaBrookeDtf liv the slut should remove hun 
001	RT BR0WNSGA I can t believe I took shit in middle school from bitches who smelled like Hollister and lived and breathed UGGS
001	 dude you have bitch hands Well you have slut hands 
001	 nudes xxx nboobs underage lesbian pussy littletits fuckme tradenudes girls nkik sexyme cumwhore horny x89 t co v1dtaQQAbq 
001	RT foreskingawd Sanders is like the guy who is all sweet and nerdy but holds you down and makes you cum until your calves cramp 
001	 CRUELBOYTHESIS I m always a slut for fluff kris I support this
001	 These bitches bright talking about profile 
001	 amabellerxse wanna zodiac sign I x89 m angel bitch moon rising 
001	 fucking europe nasty fucking angelina jolie taking lives streaming t co FPcxqCcxH8 
001	You called Oloni out I did call her out too But you have no rights to slut shame Oloni amp praise whatever the name 
001	RT fhagbot hey everyone my name is kyunchi and im a huuuuuge bitch my mom took away my credit card because i have a shopping addictio 
001	daughters amatuer couple porn tom lord nude essex girls fucked sexy ass photos best teens ava rose free 
001	 Irismariie10 im a bitch not a slut
001	 hewitt naked gorgeus movie exploited michelle williams elisha cuthbert t co 4aZFMhu0Ph 
001	Bubble butt rides creampie porn in xxx sex video nsfw orgasm wet horny pussy sex porn video xxx rt 
001	 RT for more videos like this hot nude anal porn wank camgirl cumslut amateurporn hornyteen slut selling 
001	 ameypv he slut shame the girl who wrongly accused him of RAPE ya he should jus fuq of
001	 vraviity tsuyu bakugo would friends could fucking she x89 d smile sassy back 
001	i loved ludociel when he debuted but i had no idea hed end up being a bitchy slut hes so good
001	 people What a great model she is for her kids Look mommy goes out in public dressed like a slut amp I don t care 
001	I really slut these bitches out accidentally
001	 Slim don x89 t single fuck worry about stress don x89 t ain x89 t nothing 
001	 Sassy Linn fucked people cancelling him nKeep o x89 t co 23dlD508DY 
001	relationship calling Erika costell snake bitch herself worried about peop x89 t co MHqL9ogUK7 
001	Dominating a cute Nippon slut and her furry cuntie rt asian porn videos girls hugeboobs bbw chaturbate 
001	 jameelajamil it s homage to s amp m For someone who does not slut shame you kinda did here 
001	RT tiapogai51 The Cambodian girl show her boom and pussy gt gt Then sign up Note Verify Email to send msg to girl 
001	Slut slit ur wrists u never should have dated Luke u bitch Ok Den 
001	 cool slut kinda sucks comes listen certain feeling it x89 t co Ry5BQPYunn 
001	 Maynardtology Wow bitch talk to your gf more gt l Im a huge raisin slut rum raisin ice cream raisin breads and 
001	live webcam slut Dareimegui redhead girl porn 
100	 bakubrows freakedbydubulg SaraOT5 how can u go from wonder girls and miss a to twice and these ladies lmfao i can t
001	 sexxx creampie fuck CLICK HERE TO WATCH bbw Big Clits Gaping Pussy Teens 1173
