001	 Glamerous Gomez oh i m a bitch now for defending myself after you re pressed because ava isn t all yours i m so sorry
001	That bitch a slut cut her loose Kylie lol 
001	RT JayyPhelps Mfs will dissapear for hours and then hit you up like wyd uhh losing feelings bitch where you been at 
001	understand now block don t bitch winge again there n x89 t co CGbMnakcoh 
001	 youwantsumfuck ava mfc i thought this was a pregnancy announcement from the caption but then i realized 
001	 talkingattheTV2 Thank you I am thinking tho that slut is a derogatory word whereas I think cam girl is noteworthy
001	concurso porno japones go girls nude nylons stocking colombian slut what is the best free amateur porn site african 
001	 thedailybeast LizMair Journalists chopped Saudi king Trump supports Saudi let s bitch about Hillary Clinton 
001	Hot wet pussy playing and boob teasing here Smash here camgirl wet gangbang 
001	RT yuqheis miss a bad girl good girl slut shaming 
001	I just wanna fuck you like a slut I just wanna fuck you like a slut bitch
001	Selling custom nudes buymynudes daddysgirl slut sugardaddies seekingarrangement money cashapp paypl nudes
001	RT DuchessODork Testing out the oglashes and appealcosmetics pigment that came in my latest Slut Box Definite winners New unboxing vi 
001	i am fucking slut for grocery store dip samples
100	Aren t you that guy who doxxed the girl who accused you of assault online and uploaded her nudes without her consen 
100	 GrownIsh Zoey thinks Ana lil slut butt is her girl Well at least when she finds out she ll know how it feels to 
001	 Queen Goodbye dethroning Scenario sassy bitch generation x89 sassy bitch queen x89 t co SQYsXjrJEF 
001	RT OliviaTimmons2 This bitch knows everything about adult games Sign up now wet sexy cocktribute 
001	RT OxmaJ1 Exclusive content of hotties having orgy pleasure blowbang slut hoe jizz gangbang nerdgirl cum 
001	 bitch bye23 LaSILoca Does the more you have mean you re an even bigger drug addict slut and criminal 
001	 i x89 m having listen people fat shame slut shame round about people x8d can x89 t wait x89 t co BECFNJDQWe 
001	 SlutArianaGande Mmmm daddy s fav from his slut gonna enjoy creamping u babe mmmmm 
001	Her soft moaning makes creampie better xxx 18 nsfw orgasm wet horny pussy sex porn video xxx rt follow 
001	 DRoantree hahahahahaha threatened shoot called slut called another threa x89 t co SPua85bqbh 
001	Looking Elegant as fuck trans girlnextdoor dick chat fun slut tgirl sissy 
001	RT sneakygirlfrie1 i was busy on valentine s day with my boyfriend like this tweet for a late valentines surprise slut teenslut bbcslu 
001	Ain t gonna lie ima slut for those menacing smiles from Cell amp Broly 
001	 museum slut If I were in lamps I would 
001	 fat pussy quickie young squirt hidden cumshot young parties asian insid x89 t co Wg0LVbEc7D 
001	live webcam slut WildBerry18 redhead girl porn 
001	 full length online movies girls hentai harassment sleeping adult dating t co 7bWV6XRbfh 
001	Girls who slut shame other girls are the worst type of girls
001	 girl extreme massage lesbian ebony pussy teenager facial cumshot office x89 t co YhKgiq6H9w 
001	 Selfie masturbation n t co 867LOTiKi7 liking sluts pussy indian lactation 3gp x89 t co BnCBe6U6n4 
001	 x89 my kakyoin chopped x89 x9d never ceases fucking shit 
001	RT ddaddiest even as a dom i never call someone slut whore or bitch without consent because not all subs wanna be degraded tbh
001	go follow colbaebrocks to get the full Dustin being a slut for Sam amp Colby experience
001	 masturbating lesbian russian college young black facial cumshot italian asian next x89 t co 2N6FgGgyTK 
001	RT GL0RYG1RL this bitch just pissed me off LMFAOOOOOOOOOOOOOO 
001	 obedient slut n t co kzNILS7vt4 sister unwanted creampie blonde obedient 
001	 girl pussy indian babes cumshot sloppy blowjob fucked behind beautiful amateu x89 t co i8YSpT2gcj 
001	 baileyfifield1 think it x89 s pretty pathetic someone finds telling she x89 s x89 dumb slut x89 x9d 
100	 Peril in Pink MattMcNeilShow Part of the conversation dude actually humble bragging that he can call women slut 
001	 Kensoshort can x89 t kinkshame anymore bitch 
001	RT sadcherrybitch not to be a slut but i could use a hug rn
001	almost sexting girl ignoring EMILIY ABOUT FUCKING PUNISHED IGNORING
001	CW Very lewd humiliation Mistress Riley is making me a cum slut a little pathetic girl desperately wanting to t 
001	 young girls porns clips virgin video filipina naked girls t co 4aZFMhu0Ph 
001	 girl jerks sucks cock n t co ThZknGBJVe xhamster fucks videos http www x89 t co VOKVZIUzkK 
001	masochistic slut nThat behind fairy wings t co zPzveWGP88 
001	Nude juicy boobs here just for you free signup boobs camgirl slut porn 
010	RT quinnceylon i m not about to do this on amp off shit with niggas or bitches either we fuck with eachother or we don t we cool or we no 
001	fine bitch Ava is the greatest example of the intriguingly kinky nerd camgirl 
001	 Hot stepmom getting fucked hard n t co osthOyiLFc super cumshot movie fucking sinhala photos chubb x89 t co Ux6S0li9XQ 
001	Please do explain why some girls dress like a slut to concerts I will never understand that
001	 yukeeeei x89 Hey Slut x89 nB x89 Wait bitch her x89 nC x89 That x89 s my thought pretty x89 
001	 LanaSluttyX pawgslut God bless you sweet little slut I adore sluts The best kind of girl there is So sweet and so horny So beautiful 
001	 Susie s bitch showing jungkook knowing bitch whore supposedly 20 x89 t co 2lupFakXlf 
001	RT isaabella To the beach in a thong is a slut Cut the bullshit amp yess my family knows I wear thongs to the beach because we go o 
001	why is being a slut considered such a bad thing get yours bitches
010	 love you bby Like and RT for more horny single girls amateur bbc booty cock cumslut daddy date dati 
001	RT Spoonhead8 kahnaiyo When a guy s trying to distract from one of his heroes calling a girl in her mid teens a little slut 
001	 Come scene cosplay roleplay within roleplay setup admitted slut lets 
001	RT Iocated sensitive not soft i ll punch you while i m crying bitch
001	 t co jNuMmN54bp n ncouples agent fantasy pussy porno strapon lesbian video pornhub mpg x89 t co b2jCNdkEVm 
001	RT sleazygrant yeah i m a slut and what the fuck about it bitch 
001	Big butt babe gets intensely fucked and creampied in POV cumslut tits ass horny nudes 
010	 Put picture lying death fucking wronging deserves grave horr x89 t co k0eFk8Av4O 
001	 love you bby RT and Like for more hot single girls bj booty cocktribute daddy dm f4f feet free fucked 
001	 Bitch You x89 re bitch slut 
001	 leopardom amp bacon bitch could singing duo 
001	degrading fourteen shooting videos bitch phone fucking l x89 t co TgayBE7O1S 
001	RT JackBeNimble killawatts Nvm DONT ANSWER THAT you Slut 
001	 late night thoughts sassy really triggering sometimes 
001	 CalifBob I am going to market a brand new home pregnancy test It will say Good girl or Slut 
001	 Reilly hella other sassy bitch thats lol 
001	nasty bitch thick classy ho nShit embarrass ho nShe ll shit she l x89 t co t7j680g1BT 
001	 PMV Endless Japanese CUMSHOT BUKKAKE CUM SWALLOW nt co x5baj1l2se noiled indian girls scissorin x89 t co 2xEf5RGUqq 
001	RT PamelaBitch69 Do you want to shake your hard cock in my ass RT baby Register and Write Me Note Verify 
001	RT juliaameyers tamir rice got shot and killed for carrying a small BB gun at a park but this bitch walks around a city whipping around a 
001	 robreiner Mitch McConnell is political slut He ll drag the whole country down amp into the mud 4 a political power play 
001	 gbg bucks Correction what s wrong with this female Find a real bitch that can take her smoke then change your damn caption
001	RT sugarnatrix You can t be a sissy without a wig and makeup It s essential Your clothes mean nothing until the top looks like a girl t 
001	 vscoxcx twaimz played bubblegum bitch video WIG 
001	When a guy wants some intimate moment hes horny and its normal When a girl wants some intimate moment shes suddenly a slut 
010	 MissingHGirls Three minor raped Anwar Hussain Victim family later beaten amp threatened Anwar Hussain family x89 
001	 Ass bbc n t co 7rDfa7YQ6j mixed fucked son 
001	she is my sexy gal my bitch my slut her gay punani is like rose petals i saw vaginal yeast and it remin 
001	Fun fact I am a slut for anything mint flavored Spearmint peppermint anything mint related Love it 
001	People like Kim Kardashian give boys the idea that it s normal to dress like a slut and complain about girls when t 
001	fuck XXX PORN hardcore asian video hd mobil PornTube Deutscher aunty blowjobs Video Ava Devine XXX Pron Indian Sex 
001	RT crystal090313 To girls who tryna slut around other people s bf one day you ll have a bf too amp karma really does serve u what u fucken 
001	Imagine considering a woman a slut or a bitch because you got rejected and now feel you have the authority to l 
001	I still need a good pun that says fluffy romance story about being a girlfriend and porno about fucking a slut I 
001	RT yakiraaaaaa SymmoneBBallin him being in love w someone else cheating u can say he s a horny slut bucket charge it to the game amp le 
001	 also Sparrow negan she s sassy little gives ducks about anything 
001	 royalhamp This is unrelated to spam musubi gutter slut
001	 Yea you know the bitch a slut if she never met her father has me APPALLED 
001	 liv the slut DanaBrookeDtf first first waiting do x89 t co wwQSU2HJO5 
001	black girl porn nude in public park hardcore monster hentai nude native tribes girlfriend squirts queer as blowjob 
001	RT DuncanMaddy RT to fap with nude boobs in DM girl dick lingerie fuckme wanktribute f4f hornyteen booty slut hot coc 
001	 POV Anett n t co 8QJAPi7DGF beastiality daphne rosen cumshot compilation blonde granny po x89 t co LuLC0tu3Sz 
001	RT DeeNike 1 she normalized being a bad girl Being unapologetically you Many celeb women that fake praise her now used to slut shame 
001	RT AlexisRamacey Hot wet pussy playing and boob teasing here Smash here camgirl wet gangbang boobs 
001	And she is an air headed slut 
001	RT Drugitems girl we FUCKIN the first night cause we grown and you better do everything you said you was go do in these messages PERIODT 
001	 When bitch see s husband beautiful family hopes lasts Because did x89 t co hekvYTeZFm 
001	On my daughter I m done w my BM and ima fuck this slut bitch up omdn
001	 Sex Wild Slut Ass Fucked and Skilled Deep Throat Homemade 
001	You being self aware and putting either slut bitch hoe or whore in your Instagram name doesn t make you any le 
001	lmaoo i m the slut but you out here fucking lil ass girls just smd
001	 Small tittied Alysha Rylee takes cock n t co DvUlgeSzZC raquel cumshot accide x89 t co K1iQnnvUhM 
001	how to cum in side in the pussy gt gt Then sign up Note Verify Email to send msg to girls 
001	 meryahh4 I x89 m nastiest skank bitch you x89 ll meet trust fugly slut 
001	RT kxbarajasx we re married bitch move on
001	Fake ass bitch ass thot ass slut ass hoes finally some lyrics that apply to a mf 
001	RT patrickcoope1 Cum with me DAILY for FREE Register on bellow video for get webcam nude real girl Note Verify Email to s 
001	girl porn turkish amature girl mulatto girl slut top 10 hardcore albums xxx position demo ex girlfriend free nude b 
001	Mmm I wish you d call me baby girl while you punish me for being a naughty whore im sure you do you dirty fuck 
001	ava lauren college cosplay hentai fuck my ass jasmin st claire mom fucks pick up russian milf underwater porn vint 
001	 Naughty lesson married slut n t co BK1HNU1Qxe yasmenlee Ashsmale cumshot compilatio x89 t co DCDgMT4Xwk 
001	 youre bitch messy manage perfect x89 CUTE x89 t co JjG29wI1gj 
001	 JVMES BVTTLE idi angrycorbinbleu Don x89 t about sassy bitch week 
001	 chaunirose chopped hitting telephone fucking laughed lmaooooo boring 
001	Wow i was really out here being loyal to a slut and you bitches knew too like damn y all could have said sum ik y 
001	Most guys in KU have this thing that if a girl has guys friends this indicates that she s a slut But it s more t 
010	Ava Divine gets her big ass fucked sex sexvideo porn pornvideo brazzers pornhub hardcoresex Pete pornstar 
001	RT saraamontoya To all the bitches that hate me I m doing good sis keep lurking 
001	 Many fuck pornstar every that s stripper pornstar obsess x89 t co tHaMnLW0QZ 
001	 Who s her n nI sassy bitch nshe beautiful n PCAs TheMusicVideo IDOL t co Y8R6aPbx86 
001	 Do you Like to cum watching crazy naked bitches nsfw sellingnudes cumslut fuckme pussy follow feet 
001	15 Fav Music Genre 90s R amp B and Indie Pop I guess 16 Fav Band I always say I m a slut for St Vincent but I ve 
001	 halsey i x89 m jared ni x89 m i n nfuckin myself 
001	RT lilyachty It ain t me bitch it s u
001	my boyfriend literally calls me a slut all the time amp 80 of the time it s an INSULT so like who the fuck does he t 
001	 forced cumshot cuming mouth downloadingvideofucking Pattan cocks blonde bangbros dog x89 t co YidLtUUlC3 
001	in the SU amp there s this lad i swear if i could get at him he s shouting slut and talking about all the girls he s 
001	 t co mAS0p9k6Ny school sealpack pussy incest xrated hardcore bigtite video p x89 t co 6PCbuCHvUV 
001	 itsyagirlmars shower nastiest skank bitch trust fugly slut 
001	 naked oiled boobs volleyball party videos egypt jerkoff instruction revenge girl x89 t co ZYN9Smqo9B 
001	 girls lesbian babysitter drawn hentai horny mistress cumshot surprise babysitter x89 t co CkyVizgPnd 
001	 GleekNmixer i really hope she s not tho i m all about educating people but piers has been slut shaming the girls 
001	 Vxnce x89 I prefer average slut Nothing wrong them it x89 s just typical workers always taste sooooo good x89 x9d 
001	We need to bring back slut shaming and and hiding our kinks because baby why are you PROUD amp BOASTING about eating 
001	sorry but the girl is getting body shamed slut shamed she is getting called a useless untalented girl for ten secon 
001	Deleting this shit bye bye by the way let s do one last harm Ava dank is a official whore fuck that bitch fucked my 
001	I m not arguing with you stankin ass niggas and you weak ass bitches NO MO 
001	 D0VESCRY mmmmm WATER mouth whore fucking HYDRATE that x89 s IC x89 
001	I m the nicest fucking person but if you come at me calling me a slut and such for having an opinion I will be a bitch to you Not sorry 
010	Have a good day Fl me young daddy cumtribute teen virgin nude spanking choking schoolgirl cumslut 
001	ava lauren cheating deep throat down syndrome porn extreme fucking facial cumshot indian boobs massage parlor teen 
001	bitch I ll kill you you don t wanna fuck with me girls leave you ain t nothing but a slut to me bitch I m a kill yo 
001	Even doe ion fw my dumb slut ass bd Dis still him amp Lyss pussy always amp forever mfaaaa 
001	RT tiapogai51 All the man need to peeing in her pussy gt Then sign up Note Verify Email to send msg to girls 
001	Wish you can cumshot on her ass Retweet amp like to see more Full Videos Contact me 
001	Every girl has an inner slut inside It just takes the right man or woman to help her release it 
001	RT NarcissisticNik A warrior fights for what he believes in a warrior fights for his family Bastard son of a slut amp a werewolf si 
001	 Also I x89 m assumed promiscuous constantly because having teenager makes massive slut apparently 
100	 KenzieMadisonxX Such a well trained girl 
001	 RT and Like for more and more hornyteen hot porn pussy cuckold video teens spank panties kikme slut sex scene b 
001	 wag What kinda skeet bitch every rapper sucked every rapper dick t co Av0UCCxdSN 
001	 davidsdobriks okay we get it u dont like trish but slut shaming aint the way to go about it babygirl
001	good girls get to cum you re being a bad girl right now and you know what daddy does to bad girls over my knee now slut 
001	much lazy it x89 s fucked x89 face x89 shaming t co fBqbObIWE1 
001	 adwordsgirl To make it clear we re not slut shaming 
001	 Felmo Pardon me for being rude but she s a SLUT 
001	I don t care about your bodies bitch I m a slut too 
001	Ava was glad that sniktsniktbitch was sitting down She leaned over and pressed a soft but lingering kiss to his lips Well hi there 
001	 kendall jenner nastiest skank bitch i x89 ve trust she x89 s fugly slut 
001	RT SlCHAENG what does your bias calls you aries baby taurus asshole gemini wife cancer love leo bitch virgo bff libra m 
001	 She wants treated slut bitch necessary 
001	 lt nastiest skank bitch TRUST fugly slut 
001	fucking pinaynude co cc free pics of gigi star slut video porn xxx elastic girls youtube dare room porn naked polis 
001	 XXX Deutscher Porno British 8teen Group videos Instagram Partouze vi x89 t co sNuDHfyogL 
001	 BrazzersCLASSiC JaydenTweetsXXX ANGELAWHITE AvaAddams iamspanishdoll KeiranLee I like it very sexy every one but fuck ava I like u
001	RT Gabriel25256331 Do you Like to cum watching crazy naked bitches nsfw sellingnudes cumslut fuckme pussy follow feet sho 
001	 Dating Premium Site freakybitch sexy boobs hotgirl sexyhotgirl sexcode wcw ass horny boobs tits 
001	Y all some slut ass bitches for these pieceofyourlovechallenge 
100	matter they x89 ve right shame girl 
001	Any girl want to help me edge cumtribute cocktribute hard wankchat cum cumslut whore slut cumwhore 
001	I hate slut ass bitches you bitches salute y all selves for being slutty asf psh
001	RT 1OGH I m not explaining myself all 2019 I said what I said I did what I did Get over it bitch
001	 seokjin always sassy energetic bitch laugh ear to ear t co 0UkrTC8p2u 
001	 Bald shoves dildo brunette amp 039 s before fucks her n t co RyQdCnKHxQ futanari x89 t co naYXIljS9z 
001	Why were girls so inclined to believe her and slut shame me I was 13 
001	 porn caroline interracial gangbang coeds german horny slutty tribbing belgium t co PjCQekMVTq 
001	 slut imamazing biiiiiiiitch bitch heeeey baby 
001	RT ExposeUKSluts Retweet if you like just having fun in the changing room in M amp S slut exposed leaked 
001	 thotsbytess imagine waking up out of a coma just to see a girl who called you a slut in 10th grade changing your IV
001	RT landcalsubi28 Register FREE amp watch tons of hot horny models online anytime horny boobs tits pussy porn 
001	shine by pentagon thats a mf anthem i will slut drop to that bitch like its nobodies business smh
001	Ima just be a sissy slut e girl
001	RT d0minique imagine getting on al gore s internet at a fresh ass 8am amp slut shaming victims of molestation 
001	Ava devine u bitch ass slut u fuckin owe me 1 000 
001	 porn carmen croft couple double fisting having lesbian amateur longest cumshot oldandyoung germany x89 t co Z99cxejnF4 
010	 H4gb4rdCeline legal adult amount gaping x89 t co WsH2LKGT9L 
001	 hjluttrell But my issue is the double standard of girls getting slut shammed amp khloe kardashian getting sympathy w 
001	 conangray bitch making inside where swollen the x89 
001	RT ExposeUKSluts Retweet if you like just having fun in the changing room in M amp S slut exposed leaked 
001	 cheyenne cookk gracie wilson I agree I wasn t trying to slut shame anyone All I m saying is a girl that has been 
001	RT MissMargaritaXX Both slaves crazy for My feet one is My almost daily worshipper the other one is weak and pathetic bitch who no long 
001	 girl extreme massage lesbian ebony pussy teenager facial cumshot office x89 t co YhKgiq6H9w 
001	 Rellz you better slut it up amp take these damn compliments 
001	 Aint sassy bitch t co nCXul52Z86 
001	 hell bitch flocka month century i x89 t co BkuuCfl7AA 
001	RT StewieJokess Dear girls with ur shirts to ur bellybutton amp amp shorts an inch long u aren t beautiful u are a slut Sincerely Every de 
001	smith naked summerporngirls prince charming costume adult trashy women pics xxx sleeping nude teen pics galleries 
001	 hanjob creampie school upside blowjob natural internal cumshot drinking outdoor f x89 t co qbKIBRWC8j 
001	 nadiaistoocool did you just call me a slut Cuz you re not wrong Love you and thank you cute girl 
001	RT angeliccbitch I m such a slut for flowers scented candles skin oils bath salts body butters and skin care 
001	Another clip sold Poisoned By Queen amp amp Little Slut Abuse Latex Get yours on iWantClips 
001	 RT for more videos like this girl paypal fuck slut kikme follow sessions lingerie ass cocktribute teen 
001	 Yea bitch you x89 re literally fucking bitches you x89 re hoesssss these hoessssss t co avxIYYH0Rf 
001	 ethiopian quickie creampie celeb tapes umemaro hentai squirt italian mature mo x89 t co IV8j2CPxb4 
001	 german swingers girls rated movies retro cumshot facefuck blond x89 t co 1TvXjljc5s 
001	bitches porno hockey girls sex boy have sex with girls jessica biel nude pix american gangster sex scenes hawian gi 
100	 Women shame didn x89 t spooky baskets thing t co NxkGfpxzXb 
001	 t co X0BOxwgN4j n npussy xvideo cumshot creampie dapink perfect gonzo mofos female x89 t co Ko8CS8PYUz 
001	RT tiapogai51 Oh yes she likes big pines gt Then sign up Note Verify Email to send msg to girls slut 
001	RT yourlocalmess i know u miss me bitch stop acting hard
001	RT tshade1of1 lmao that mf was Heat he had to run that bitch back otg lmfaooooo 
001	 hahahaha veronica talking about archie front betty sassy bitch 
001	 Don x89 t chorizo wants sassy hands same 
001	 porn jennifer xbideos baldpussy cumshot compilation first fucking mexican young pussy austra x89 t co NJXk18TdKb 
001	 l5atd Doctor raped beautiful fuck n n pussyeat cumshot n xa0 n xa0 x81 xa0 x81 x89 
001	 donnyforevs Who s fucking girl bitch brave enough magpapakilala hindi lang x89 t co 3aAOgIBVe5 
001	Today while me and my coworkers were performing care one of the residents called us bitch nigger whores like 4xs 
001	intercourse for married couples beautiful long legged girls porn trafic teen age interracial porn nude free girl po 
001	 t co mF0DbOINpq n nporno small videos pictures mistress agent pornhub naked fetish a x89 t co Yzdht1GthA 
001	bitch audacity gonna awakening try x89 t co 8cpW6DRCPa 
001	 maggiehendricks SarahSpain Queen used to fuck with a magical piece of shit might be the best summary to any piece of art ever
001	RT TaesBxbygirl I m in the mood to be eaten out and fucked like the little slut i am
001	No man texted me in 2 days Start my period Ding ding bitch it s me let fuck Bruhhhhh
001	ooouuuu fuck put your clothes on you dirty slut before I eat you alive creamy ass bitch 
001	 Tbt baby child I x89 m sassy bitch t co Fhs768qdjW 
001	Please do not slide into my shit if you re one of the MANY boys that slut shamed amp dissed on me last may trust me I didn t forget
001	Selling Custom Feet Pics amp custom pictures or nudes Let me be your muse sugardaddy sugarmommy slut 
001	 weakforkings acted several dramas Cinderella knights sassy girl smell etc 
001	RT CaseyAn74128580 DM me for some private fun like and RT snapchat schoolgirl cumslut cockslut snap slut cumwhore jailbait jai 
001	I got 1hour left guys pmme fast and buy my droobox for 10 kinkygirl slut slutty fuckme yesdaddy daddy 
001	Imagine calling a girl a slut cuz she won t date you 
001	Hot naked girls Caroline03 I m here for some fun and pleasure so let s play a game as u want in ur fantasy 
001	 Nasty sucking fucking t co sjIfdUTioa laren hardcore european lolita sexi x89 t co AT2e4tRPsU 
001	 wild upskirt mutual masterbation worlds biggest cumshot wasteland tin x89 t co XiuPkJxu1p 
001	 Slut swingers blondee amp amp brunette anal n t co lYVdiKvvXr chyna wrestler japan xwid x89 t co 22dQE47jTY 
001	Every girl that was a slut in high school is involved in a pyramid scheme now
001	Do yal really think herb gaf ole girl been a slut and he knew it 
001	RT JaeYonnaa If u don t like me in REAL life don t follow me on social media Weird ass bitch 
001	 Eminem Kim is ugly bro I could get Kim in a sec on believe only bitch Are you ready for that slut to have my kid 
001	Overheard a girl in the union bathroom claiming that you d have to be a slut to need to use the large tampons and p 
001	i m a slut for tacos amp im going to go be a slut right now 
001	living standards nIt x89 s illusion I x89 m fucking nWaiting waiting WAITING 
001	RT hfskin do girls who slut shame other girls deserve rights the answer is no
001	I just got called a plethora of names rude entitled bitch cunt slut bc I refused to accept this dudes money t 
001	 Aliseuknow guess Halloween dress slut candy murder x8f x89 x8d x89 x95 x8f 
001	 wheat thick1 He called my cat a slut amp fixed my dog a steak I think I know who he likes better
001	 destinedzionxo Speaking shaming ya ll who s freaky shame women sexually active amp embrace their s x89 
001	I m wearing something naughty under this trans girlnextdoor dick chat fun slut tgirl sissy 
001	petnames kitten in subspace slut or toy in subspace baby girl princess doll 
001	 Dick Bitch asshole pussy faced bitch I x89 m pancake sandcastle looking x89 t co rFpYVX2wBN 
001	 What wants myself pocke pussy nSnapchat hornyman7988 n hot horny sexy nude x89 t co dEWkn0rgTj 
001	 virgin extreme mature swingers black lesbians drunk punish mature orgasm movies r x89 t co wqxHbFyYDg 
100	 Racist Leftist Demoncrats intolerance t co 90agtLsTOf 
001	RT prncessalli bitches really be thinking they something to hate on 
001	RT NielsKnk beamanforreal Calling women bitch is wrong The correct pronoun is my little slut 
001	I may be alone on this but I don t really like Ariana Grande anymore She s kinda actin like a slut amp giving the w 
010	all i hear is fucking moron you re so stupid you re an ugly slut go kill yourself and other things i don t 
001	RT cryptcouture vampire slut gets new fangs 
001	 at thrift store nmy logic bitch spend goddamn dollar wildly printed waisted pants I x89 t co TYzTO2eqPy 
001	 makeme scream01 It depends At the beginning I like kitty baby Once I approach my climax I love been called bitch 
